rank,arabic_lemma,transliteration,english_core_gloss,part_of_speech,canonical_form_rule_used,root_if_relevant,estimated_frequency_tier,dispersion_score,usefulness_score,register_label,keep_reason,merged_forms_or_variants,notes
1127,جائِزَة,jA}izap,Awardable.,noun,noun: singular lemma,,T2,0.333,8.856,media,high_frequency + dispersion,الجائزة; الجوائز; بجائزة; جائزة; جوائز ...,
1128,مُؤَشِّر,mu&a$~ir,Indicator,noun,noun: singular lemma,,T2,0.333,8.856,media,high_frequency + dispersion,المؤشر; المؤشرات; للمؤشر; مؤشر; مؤشرا ...,
1129,ميدفيديف,mydfydyf,Medvedev.,noun_prop,noun: singular lemma,,T2,0.333,8.855,media,high_frequency + dispersion,ميدفيديف,
1130,عِلاج,EilAj,Treatment,noun,noun: singular lemma,علج,T2,0.333,8.855,media,high_frequency + dispersion,العلاج; العلاجات; بعلاج; علاج; علاجا ...,
1131,شِراء,$irA',Buy.,noun,noun: singular lemma,,T2,0.333,8.853,media,high_frequency + dispersion,الشراء; بشراء; شراء; شرائها; لشراء ...,
1132,هِنْد,hinod,Hend.,noun_prop,noun: singular lemma,هند,T2,0.333,8.851,media,high_frequency + dispersion,الهند; بالهند; للهند; هند; والهند,
1133,أَفْرِيقِيا,>aforiyqiyA,Africa,noun_prop,noun: singular lemma,,T2,0.333,8.851,media,high_frequency + dispersion,أفريقيا; إفريقيا; افريقيا; وأفريقيا; وافريقيا,
1134,خَسِر,xasir,Lose.,verb,verb: 3ms past lemma,خسر,T2,0.333,8.85,media,high_frequency + dispersion,تخسر; خسر; خسرت; خسرنا; خسروا ...,
1135,صَحافَة,SaHAfap,Press.,noun,noun: singular lemma,صحف,T2,0.333,8.85,media,high_frequency + dispersion,الصحافة; بالصحافة; صحافة; للصحافة; والصحافة,
1136,مُشارِك,mu$Arik,Partner.,noun,noun: singular lemma,شرك,T2,0.333,8.848,media,high_frequency + dispersion,المشارك; المشاركون; المشاركين; للمشاركين; مشارك ...,
1137,آلِيَّة,|liy~ap,A robot.,noun,noun: singular lemma,,T2,0.333,8.847,media,high_frequency + dispersion,آليات; آلية; الآليات; الآلية; الاليات ...,
1138,ٱِعْتِراف,{iEotirAf,Confession,noun,noun: singular lemma,عرف,T2,0.333,8.846,media,high_frequency + dispersion,اعتراف; اعترافا; اعترافات; اعترافه; اعترافها ...,
1139,مُحاكَمَة,muHAkamap,Trial.,noun,noun: singular lemma,حكم,T2,0.333,8.846,media,high_frequency + dispersion,المحاكمات; المحاكمة; بمحاكمة; للمحاكمة; لمحاكمة ...,
1140,أَدار,>adAr,I'm running.,verb,verb: 3ms past lemma,,T2,0.333,8.846,media,high_frequency + dispersion,أدار; تدار; تدير; تديره; تديرها ...,
1141,صَنْع,SanoE,Made,noun,noun: singular lemma,صنع,T2,0.333,8.844,media,high_frequency + dispersion,الصنع; بصنع; تصنع; تصنعها; صنع ...,
1142,فاق,fAq,Get up.,verb,verb: 3ms past lemma,,T2,0.333,8.844,media,high_frequency + dispersion,تفوق; تفوقها; فاق; فاقت; وتفوق ...,
1143,مُنْتَج,munotaj,Produced,noun,noun: singular lemma,نتج,T2,0.333,8.843,media,high_frequency + dispersion,المنتج; المنتجات; المنتجة; المنتجين; للمنتجات ...,
1144,سِيادَة,siyAdap,Gentlemen.,noun,noun: singular lemma,,T2,0.333,8.842,media,high_frequency + dispersion,السيادة; بالسيادة; بسيادة; سيادة; سيادته ...,
1145,عادَة,EAdap,Usually.,noun,noun: singular lemma,,T2,0.333,8.841,media,high_frequency + dispersion,العادات; العادة; العوائد; عادات; عادة ...,
1146,كُرْدِسْتان,kurodisotAn,Two balls.,noun_prop,noun: singular lemma,,T2,0.333,8.84,media,high_frequency + dispersion,كردستان; كُردستان; لكردستان; وكردستان,
1147,صَفْقَة,Safoqap,A deal.,noun,noun: singular lemma,صفق,T2,0.333,8.84,media,high_frequency + dispersion,الصفقات; الصفقة; بصفقة; صفقات; صفقة ...,
1148,قارَب,qArab,Boat.,verb,verb: 3ms past lemma,قرب,T2,0.333,8.839,media,high_frequency + dispersion,أقاربه; القارب; القوارب; قارب; قاربت ...,
1149,نَجّاد,naj~Ad,Help!,noun_prop,noun: singular lemma,نجد,T2,0.333,8.839,media,high_frequency + dispersion,نجاد,
1150,قانُونِيّ,qAnuwniy~,My law.,adj,adj: masc singular lemma,قنن,T2,0.333,8.837,media,high_frequency + dispersion,القانوني; القانونية; القانونيين; قانوني; قانونيا ...,
1151,قَوِيّ,qawiy~,My strength.,adj,adj: masc singular lemma,,T2,0.333,8.836,media,high_frequency + dispersion,أقوياء; الأقوياء; القوية; تقوى; تقوي ...,
1152,حَثّ,Hav~,Happened.,verb,verb: 3ms past lemma,حثث,T2,0.333,8.835,media,high_frequency + dispersion,تحث; حث; حثت; لحث; وحث ...,
1153,ٱِنْخَفَض,{inoxafaD,Absolutely!,verb,verb: 3ms past lemma,خفض,T2,0.333,8.833,media,high_frequency + dispersion,انخفض; انخفضت; تنخفض; سينخفض; وانخفض ...,
1154,حَفْل,Hafol,Celebrating.,noun,noun: singular lemma,حفل,T2,0.333,8.833,media,high_frequency + dispersion,الحفل; بحفل; حفل; حفلا; حفلاً ...,
1155,ضَمان,DamAn,Guarantee,noun,noun: singular lemma,ضمن,T2,0.333,8.833,media,high_frequency + dispersion,الضمان; بضمان; ضمان; ضمانا; لضمان ...,
1156,رِيال,riyAl,Rial!,noun,noun: singular lemma,,T2,0.333,8.833,media,high_frequency + dispersion,الريال; الريالات; ريال; ريالا; ريالات ...,
1157,مَعْرِض,maEoriD,Offered,noun,noun: singular lemma,عرض,T2,0.333,8.832,media,high_frequency + dispersion,المعرض; المعرضة; للمعرض; لمعرض; معرض ...,
1158,داعِي,dAEiy,Say goodbye.,noun,noun: singular lemma,,T2,0.333,8.832,media,high_frequency + dispersion,الداعي; الداعية; الداعين; الدعاة; بداعي ...,
1159,جَيِّد,jay~id,Good.,adj,adj: masc singular lemma,,T2,0.333,8.831,media,high_frequency + dispersion,الجيد; الجيدة; جيد; جيدا; جيداً ...,
1160,ناتُو,nAtuw,Nato.,noun_prop,noun: singular lemma,,T2,0.333,8.83,media,high_frequency + dispersion,الناتو; للناتو; ناتو; والناتو,
1161,صِفَة,Sifap,Description,noun,noun: singular lemma,,T2,0.333,8.826,media,high_frequency + dispersion,الصفات; الصفة; بصفة; بصفته; بصفتها ...,
1162,شابّ,$Ab~,Young.,noun,noun: singular lemma,شبب,T2,0.333,8.822,media,high_frequency + dispersion,الشاب; الشابين; الشبان; شاب; شابا ...,
1163,رُوح,ruwH,Spirit.,noun,noun: singular lemma,,T2,0.333,8.822,media,high_frequency + dispersion,أرواح; أرواحهم; ارواح; الأرواح; الارواح ...,
1164,ثَمانِي,vamAniy,Eight.,adj,adj: masc singular lemma,ثمن,T2,0.333,8.819,media,high_frequency + dispersion,الثماني; الثمانية; الثمانين; بثمانية; ثمان ...,
1165,وَحِيد,waHiyd,Alone.,adj,adj: masc singular lemma,,T2,0.333,8.818,media,high_frequency + dispersion,الوحيد; الوحيدة; والوحيد; وحيد; وحيدا ...,
1166,سَهْم,sahom,Arrow.,noun,noun: singular lemma,سهم,T2,0.333,8.817,media,high_frequency + dispersion,أسهم; أسهمها; اسهم; الأسهم; الاسهم ...,
1167,إِيجاد,<iyjAd,Find...,noun,noun: singular lemma,,T2,0.333,8.815,media,high_frequency + dispersion,إيجاد; ايجاد; بإيجاد; لإيجاد; لايجاد ...,
1168,تَنْسِيق,tanosiyq,You're coordinating.,noun,noun: singular lemma,نسق,T2,0.333,8.814,media,high_frequency + dispersion,التنسيق; بالتنسيق; بتنسيق; تنسيق; لتنسيق ...,
1169,قَصْف,qaSof,Abort.,noun,noun: singular lemma,قصف,T2,0.333,8.813,media,high_frequency + dispersion,القصف; بقصف; تقصف; قصف; قصفت ...,
1170,أَخْرَج,>axoraj,Get out.,verb,verb: 3ms past lemma,خرج,T2,0.333,8.811,media,high_frequency + dispersion,أخرجت; أخرجه; اخرج; نخرج; يخرج,
1171,فَوْق,fawoq,Wake up.,noun,noun: singular lemma,,T2,0.333,8.811,media,high_frequency + dispersion,فوق; فوقه; فوقها; وفوق,
1172,رَبْط,raboT,Tie.,noun,noun: singular lemma,ربط,T2,0.333,8.811,media,high_frequency + dispersion,الربط; بربط; تربط; تربطه; تربطها ...,
1173,مُراقِب,murAqib,Watcher.,noun,noun: singular lemma,رقب,T2,0.333,8.81,media,high_frequency + dispersion,المراقب; المراقبون; المراقبين; مراقب; مراقبا ...,
1174,واسِع,wAsiE,Broad.,adj,adj: masc singular lemma,,T2,0.333,8.81,media,high_frequency + dispersion,الواسع; الواسعة; واسع; واسعا; واسعاً ...,
1175,سَبْع,saboE,Seven.,adj,adj: masc singular lemma,سبع,T2,0.333,8.806,media,high_frequency + dispersion,السبع; السبعة; السبعين; بسبع; بسبعة ...,
1176,طِيلَةَ,Tiylapa,Long.,prep,particle/base,طلة,T2,0.333,8.805,media,high_frequency + dispersion,طيلة,
1177,جَدَّد,jad~ad,New,verb,verb: 3ms past lemma,جدد,T2,0.333,8.805,media,high_frequency + dispersion,جدد; جددت; وجدد; وجددت; يجدد,
1178,أَدْلَى,>adolaY,Come in.,verb,verb: 3ms past lemma,,T2,0.333,8.803,media,high_frequency + dispersion,أدلت; أدلوا; أدلى; ادلى; وأدلى ...,
1179,لَحْظَة,laHoZap,Wait a minute.,noun,noun: singular lemma,لحظ,T2,0.333,8.803,media,high_frequency + dispersion,اللحظات; اللحظة; لحظات; لحظة; للحظة,
1180,أَنْهَى,>anohaY,It's over.,verb,verb: 3ms past lemma,,T2,0.333,8.803,media,high_frequency + dispersion,أنهت; أنهى; انهت; انهى; تنهي ...,
1181,اخري،,Axry،,Another,noun_prop,noun: singular lemma,,T2,0.333,8.802,media,high_frequency + dispersion,أخرى،; اخرى،,
1182,تارِيخِيّ,tAriyxiy~,Tarikhi,adj,adj: masc singular lemma,,T2,0.333,8.801,media,high_frequency + dispersion,التأريخية; التاريخي; التاريخية; تاريخي; تاريخيا ...,
1183,صَعْب,SaEob,It's hard.,adj,adj: masc singular lemma,صعب,T2,0.333,8.801,media,high_frequency + dispersion,الصعاب; الصعب; الصعبة; تصعب; صعب ...,
1184,جَمِيل,jamiyl,Beautiful.,noun_prop,noun: singular lemma,جمل,T2,0.333,8.796,media,high_frequency + dispersion,الجميل; الجميلة; الجميّل; جميل; جميلا ...,
1185,مُباحَثَة,mubAHavap,Searching.,noun,noun: singular lemma,بحث,T2,0.333,8.795,media,high_frequency + dispersion,المباحثات; مباحثات; مباحثاته; مباحثاتهما,
1186,ٱِسْتَغْرَق,{isotagoraq,.........,verb,verb: 3ms past lemma,غرق,T2,0.333,8.791,media,high_frequency + dispersion,استغرق; استغرقت; تستغرق; ستستغرق; سيستغرق ...,
1187,فرانْس,frAnos,Francis!,noun_prop,noun: singular lemma,,T2,0.333,8.79,media,high_frequency + dispersion,فرانس; لفرانس,
1188,تَسْلِيم,tasoliym,Surrender.,noun,noun: singular lemma,سلم,T2,0.333,8.789,media,high_frequency + dispersion,التسليم; بتسليم; بتسليمه; بتسليمها; تسليم ...,
1189,صَحِيح,SaHiyH,Right.,adj,adj: masc singular lemma,صحح,T2,0.333,8.788,media,high_frequency + dispersion,الصحيح; الصحيحة; الصحيحين; صحيح; صحيحا ...,
1190,بارِيس,bAriys,Bryce.,noun_prop,noun: singular lemma,,T2,0.333,8.787,media,high_frequency + dispersion,باريس; بباريس; لباريس; وباريس,
1191,جِنْسِيَّة,jinosiy~ap,Sexy.,noun,noun: singular lemma,جنس,T2,0.333,8.786,media,high_frequency + dispersion,الجنسيات; الجنسية; جنسيات; جنسيته,
1192,مَعْبَر,maEobar,Pass.,noun,noun: singular lemma,عبر,T2,0.333,8.786,media,high_frequency + dispersion,المعابر; المعبر; المعبرة; معابر; معبر ...,
1193,تِلفِزيُون,tilfizyuwn,TV.,noun,noun: singular lemma,,T2,0.333,8.785,media,high_frequency + dispersion,التلفزيون; التلفزيونات; التليفزيون; تلفزيون; تليفزيون ...,
1194,مَوْسِم,mawosim,Order.,noun,noun: singular lemma,,T2,0.333,8.785,media,high_frequency + dispersion,المواسم; الموسم; للموسم; لموسم; مواسم ...,
1195,غَد,gad,Tomorrow.,noun,noun: singular lemma,,T2,0.333,8.785,media,high_frequency + dispersion,الغد; غد; غدا; غداً; غدًا ...,
1196,شُكْر,$ukor,Thank you.,noun,noun: singular lemma,شكر,T2,0.333,8.785,media,high_frequency + dispersion,أشكر; اشكر; الشكر; بالشكر; تشكر ...,
1197,تَبِع,tabiE,Follow.,verb,verb: 3ms past lemma,تبع,T2,0.333,8.784,media,high_frequency + dispersion,اتبعها; تبعا; تبعاً; تبعه; تبعها ...,
1198,ٱِنْتِخابِيّ,{inotixAbiy~,My election.,adj,adj: masc singular lemma,نخب,T2,0.333,8.784,media,high_frequency + dispersion,الإنتخابية; الانتخابي; الانتخابية; انتخابي; انتخابيا ...,
1199,كلِينْتُون,kliynotuwn,Clinton.,noun_prop,noun: singular lemma,,T2,0.333,8.783,media,high_frequency + dispersion,كلينتون; لكلينتون; وكلينتون,
1200,ٱِحْتِجاج,{iHotijAj,Protest.,noun,noun: singular lemma,حجج,T2,0.333,8.783,media,high_frequency + dispersion,احتجاج; احتجاجا; احتجاجات; احتجاجاً; احتجاجهم ...,
1201,تَصْوِيت,taSowiyt,I voted.,noun,noun: singular lemma,,T2,0.333,8.782,media,high_frequency + dispersion,التصويت; بالتصويت; تصويت; للتصويت; والتصويت,
1202,تَوَتُّر,tawat~ur,Trouble.,noun,noun: singular lemma,,T2,0.333,8.782,media,high_frequency + dispersion,التوتر; التوترات; بالتوتر; توتر; توترا ...,
1203,أَجاب,>ajAb,He answered.,verb,verb: 3ms past lemma,,T2,0.333,8.782,media,high_frequency + dispersion,أجاب; أجابت; إجابة; إجابته; اجاب ...,
1204,عَدْل,Eadol,Modify.,noun,noun: singular lemma,عدل,T2,0.333,8.781,media,high_frequency + dispersion,العدل; بالعدل; تعدل; عدل; عدلت ...,
1205,آبِد,|bid,Forever.,noun,noun: singular lemma,,T2,0.333,8.779,media,high_frequency + dispersion,ابدا; ابداً; الأبد; الابد; فلابد ...,
1206,هاجَم,hAjam,Attack!,verb,verb: 3ms past lemma,هجم,T2,0.333,8.779,media,high_frequency + dispersion,تهاجم; هاجم; هاجمت; هاجموا; وهاجم ...,
1207,مُواصَلَة,muwASalap,Continuation,noun,noun: singular lemma,,T2,0.333,8.779,media,high_frequency + dispersion,المواصلات; بمواصلة; لمواصلة; مواصلة; والمواصلات ...,
1208,سِبْتَمْبِر,sibotamobir,Spectambra.,noun_prop,noun: singular lemma,,T2,0.333,8.775,media,high_frequency + dispersion,سبتمبر,
1209,مُصالَحَة,muSAlaHap,Correct.,noun,noun: singular lemma,صلح,T2,0.333,8.775,media,high_frequency + dispersion,المصالحات; المصالحة; بالمصالحة; للمصالحة; مصالحات ...,
1210,رَسْم,rasom,Paint.,noun,noun: singular lemma,رسم,T2,0.333,8.774,media,high_frequency + dispersion,الرسم; الرسوم; الرسومات; برسم; ترسم ...,
1211,مَحَلّ,maHal~,Nope.,noun,noun: singular lemma,حلل,T2,0.333,8.774,media,high_frequency + dispersion,المحل; المحلات; محال; محالة; محل ...,
1212,مُوسَى,muwsaY,Moses.,noun_prop,noun: singular lemma,,T2,0.333,8.773,media,high_frequency + dispersion,الموسى; موسى; موسي; وموسى,
1213,مُتابَعَة,mutAbaEap,Followed.,noun,noun: singular lemma,تبع,T2,0.333,8.772,media,high_frequency + dispersion,المتابعة; بمتابعة; لمتابعة; متابعة; متابعته ...,
1214,بَرَى,baraY,He's gone.,noun,noun: singular lemma,,T2,0.333,8.771,media,high_frequency + dispersion,البري; البرية; براك; بري; برية ...,
1215,مَقْعَد,maqoEad,Seat.,noun,noun: singular lemma,قعد,T2,0.333,8.771,media,high_frequency + dispersion,المقاعد; المقعد; بمقعد; مقاعد; مقاعده ...,
1216,والِد,wAlid,A father.,noun,noun: singular lemma,,T2,0.333,8.77,media,high_frequency + dispersion,الوالد; الوالدة; الوالدين; لوالده; والد ...,
1217,مَرْكَزِيّ,marokaziy~,My focus.,adj,adj: masc singular lemma,ركز,T2,0.333,8.769,media,high_frequency + dispersion,المركزى; المركزي; المركزية; مركزي; مركزية,
1218,بَقاء,baqA',Stay.,noun,noun: singular lemma,,T2,0.333,8.764,media,high_frequency + dispersion,البقاء; بالبقاء; ببقاء; بقاء; بقاءه ...,
1219,جَزائِر,jazA}ir,Miracles.,noun_prop,noun: singular lemma,جزر,T2,0.333,8.761,media,high_frequency + dispersion,الجزائر; بالجزائر; للجزائر; والجزائر,
1220,سَراح,sarAH,I'm going to bed.,noun,noun: singular lemma,سرح,T2,0.333,8.76,media,high_frequency + dispersion,السراح; سراح; سراحه; سراحها; سراحهم ...,
1221,رِحْلَة,riHolap,Traveling.,noun,noun: singular lemma,رحل,T2,0.333,8.76,media,high_frequency + dispersion,الرحلات; الرحلة; برحلات; برحلة; رحلات ...,
1222,ٱِدَّعَى,{id~aEaY,Pretend.,verb,verb: 3ms past lemma,,T2,0.333,8.759,media,high_frequency + dispersion,ادعت; ادعوا; ادعى; تدعي; تدّعي ...,
1223,مُخَيَّم,muxay~am,Camped.,noun,noun: singular lemma,,T2,0.333,8.759,media,high_frequency + dispersion,المخيم; المخيمات; للمخيم; مخيم; مخيمات,
1224,بَسّ,bas~,Put it on.,verb,verb: 3ms past lemma,بسس,T2,0.333,8.759,media,high_frequency + dispersion,بس; وبس,
1225,ماكين,mAkyn,McCain.,noun_prop,noun: singular lemma,,T2,0.333,8.757,media,high_frequency + dispersion,ماكين,
1226,تَرَأَّس,tara>~as,Heading.,verb,verb: 3ms past lemma,,T2,0.333,8.756,media,high_frequency + dispersion,تترأس; ترأس; ترأسه; ترأسها; سيترأس ...,
1227,قَبْض,qaboD,Catch.,noun,noun: singular lemma,قبض,T2,0.333,8.756,media,high_frequency + dispersion,القبض; بالقبض; قبض; قبضت; للقبض ...,
1228,شِعار,$iEAr,Poetry.,noun,noun: singular lemma,شعر,T2,0.333,8.755,media,high_frequency + dispersion,الشعار; الشعارات; بالشعارات; بشعار; بشعارات ...,
1229,إِيهُود,<iyhuwd,Hood.,noun_prop,noun: singular lemma,,T2,0.333,8.751,media,high_frequency + dispersion,أيهود; إيهود; ايهود; وايهود,
1230,مُقارَنَة,muqAranap,Compared.,noun,noun: singular lemma,قرن,T2,0.333,8.751,media,high_frequency + dispersion,المقارنة; بالمقارنة; للمقارنة; مقارنة; مقارنتها ...,
1231,طَبِيعِيّ,TabiyEiy~,Of course.,adj,adj: masc singular lemma,طبع,T2,0.333,8.75,media,high_frequency + dispersion,الطبيعى; الطبيعي; الطبيعية; طبيعي; طبيعيا ...,
1232,رابِع,rAbiE,Four.,adj,adj: masc singular lemma,ربع,T2,0.333,8.748,media,high_frequency + dispersion,الرابع; الرابعة; رابع; رابعا; رابعاً ...,
1233,سُرْعَة,suroEap,Hurry!,noun,noun: singular lemma,سرع,T2,0.333,8.748,media,high_frequency + dispersion,السرعة; بالسرعة; بسرعة; سرعة; سرعتها ...,
1234,أَنْتَ,>anota,You.,pron,particle/base,,T2,0.333,8.748,media,high_frequency + dispersion,أنت; أنتِ; إنت; انت; فأنت ...,
1235,قادِر,qAdir,Capricorn.,adj,adj: masc singular lemma,قدر,T2,0.333,8.747,media,high_frequency + dispersion,القادر; القادرة; القادرين; قادر; قادرا ...,
1236,ٱِعْتِماد,{iEotimAd,Approving...,noun,noun: singular lemma,عمد,T2,0.333,8.747,media,high_frequency + dispersion,اعتماد; اعتمادا; اعتماداً; اعتماده; اعتمادها ...,
1237,أَقْصَى,>aqoSaY,Cut.,noun_prop,noun: singular lemma,,T2,0.333,8.746,media,high_frequency + dispersion,أقصاه; أقصاها; أقصى; اقصى; الأقصى ...,
1238,كلم,klm,Talk.,abbrev,particle/base,,T2,0.333,8.746,media,high_frequency + dispersion,فكلما; كلم; كلما; وكلما,
1239,فَوْر,fawor,Furry.,noun,noun: singular lemma,,T2,0.333,8.746,media,high_frequency + dispersion,الفور; فور; فورا; فوراً; فورة ...,
1240,مُقابَلَة,muqAbalap,Meet.,noun,noun: singular lemma,قبل,T2,0.333,8.746,media,high_frequency + dispersion,المقابلات; المقابلة; لمقابلة; مقابلات; مقابلة ...,
1241,مَطْلَع,maTolaE,Enlightened.,noun,noun: singular lemma,طلع,T2,0.333,8.745,media,high_frequency + dispersion,مطلع; مطلعة; ومطلع,
1242,بَذْل,ba*ol,Beat it.,noun,noun: singular lemma,بذل,T2,0.333,8.745,media,high_frequency + dispersion,ببذل; بذل; بذلت; بذلتها; بذله ...,
1243,حَلِيف,Haliyf,An ally.,noun,noun: singular lemma,حلف,T2,0.333,8.745,media,high_frequency + dispersion,الحلفاء; الحليف; الحليفة; حلفاء; حلفائنا ...,
1244,تَمَيَّز,tamay~az,A distinction.,verb,verb: 3ms past lemma,,T2,0.333,8.745,media,high_frequency + dispersion,التميز; تتميز; تميزت; والتميز; وتتميز ...,
1245,نِيُويُورْك,niyuwyuwrok,Newerk.,noun_prop,noun: singular lemma,,T2,0.333,8.745,media,high_frequency + dispersion,النيويورك; بنيويورك; نيويورك; ونيويورك,
1246,ناخِب,nAxib,A voter.,noun,noun: singular lemma,نخب,T2,0.333,8.744,media,high_frequency + dispersion,الناخب; الناخبون; الناخبين; للناخبين; ناخب ...,
1247,صِحِّيّ,SiH~iy~,Healthy.,adj,adj: masc singular lemma,صحح,T2,0.333,8.743,media,high_frequency + dispersion,الصحى; الصحي; الصحية; صحي; صحيا ...,
1248,وَضَّح,waD~aH,Explain.,verb,verb: 3ms past lemma,,T2,0.333,8.743,media,high_frequency + dispersion,توضح; وضح; ويوضح; يوضح,
1249,مُعارِض,muEAriD,Against...,noun,noun: singular lemma,عرض,T2,0.333,8.742,media,high_frequency + dispersion,المعارض; المعارضون; المعارضين; معارض; معارضا ...,
1250,شَرْقِيّ,$aroqiy~,My light.,adj,adj: masc singular lemma,شرق,T2,0.333,8.741,media,high_frequency + dispersion,الشرقي; الشرقية; الشرقيين; شرقي; شرقية ...,
1251,يُونِيُو,yuwniyuw,Yoonyo!,noun_prop,noun: singular lemma,,T2,0.333,8.739,media,high_frequency + dispersion,يونيو,
1252,مَطْلَب,maTolab,Requesting,noun,noun: singular lemma,طلب,T2,0.333,8.739,media,high_frequency + dispersion,المطالب; المطلب; بمطالب; بمطالبة; للمطالب ...,
1253,إِنْسانِيّ,<inosAniy~,Forget me.,adj,adj: masc singular lemma,,T2,0.333,8.737,media,high_frequency + dispersion,إنساني; إنسانية; الإنساني; الانساني; الانسانية ...,
1254,مُمْكِن,mumokin,Maybe.,adj,adj: masc singular lemma,مكن,T2,0.333,8.737,media,high_frequency + dispersion,الممكن; الممكنة; ممكن; ممكنا; ممكناً ...,
1255,فَقَد,faqad,Lost.,verb,verb: 3ms past lemma,فقد,T2,0.333,8.737,media,high_frequency + dispersion,تفقده; سيفقد; فقدت; فقدنا; فقدوا ...,
1256,تَأْمِين,ta>omiyn,You're safe.,noun,noun: singular lemma,,T2,0.333,8.736,media,high_frequency + dispersion,التأمين; التأمينات; التامين; بتأمين; تأمين ...,
1257,جُون,juwn,John.,noun_prop,noun: singular lemma,,T2,0.333,8.734,media,high_frequency + dispersion,جون; لجون; وجون,
1258,مايُو,mAyuw,Mayo.,noun_prop,noun: singular lemma,,T2,0.333,8.733,media,high_frequency + dispersion,مايو,
1259,مَغْرِب,magorib,Weird.,noun_prop,noun: singular lemma,غرب,T2,0.333,8.732,media,high_frequency + dispersion,المغرب; بالمغرب; للمغرب; والمغرب,
1260,طَبْع,TaboE,Sure.,noun,noun: singular lemma,طبع,T2,0.333,8.731,media,high_frequency + dispersion,بالطبع; تطبع; طبع; طبعا; طبعاً ...,
1261,نَقْد,naqod,We drive.,noun,noun: singular lemma,نقد,T2,0.333,8.73,media,high_frequency + dispersion,النقد; النقود; بالنقد; للنقد; نقد ...,
1262,خَصَّص,xaS~aS,Specialized,verb,verb: 3ms past lemma,خصص,T2,0.333,8.729,media,high_frequency + dispersion,تخصص; تخصصه; خصص; خصصت; ستخصص ...,
1263,مُعاهَدَة,muEAhadap,A treaty.,noun,noun: singular lemma,عهد,T2,0.333,8.729,media,high_frequency + dispersion,المعاهدات; المعاهدة; للمعاهدة; معاهدات; معاهدة ...,
1264,مُتَطَرِّف,mutaTar~if,Excuse me.,noun,noun: singular lemma,طرف,T2,0.333,8.727,media,high_frequency + dispersion,المتطرف; المتطرفة; المتطرفون; المتطرفين; للمتطرفين ...,
1265,وَقُود,waquwd,Drive.,noun,noun: singular lemma,,T2,0.333,8.726,media,high_frequency + dispersion,الوقود; بالوقود; للوقود; والوقود; وقود,
1266,زَوْج,zawoj,Marry.,noun,noun: singular lemma,,T2,0.333,8.723,media,high_frequency + dispersion,الأزواج; الزوج; الزوجان; الزوجين; زوج ...,
1267,أَسْوَد,>asowad,Black.,noun,noun: singular lemma,,T2,0.333,8.723,media,high_frequency + dispersion,اسود; الأسود; الاسود; السود; السوداء ...,
