rank,arabic_lemma,transliteration,english_core_gloss,part_of_speech,canonical_form_rule_used,root_if_relevant,estimated_frequency_tier,dispersion_score,usefulness_score,register_label,keep_reason,merged_forms_or_variants,notes
2100,مُقِيم,muqiym,Resident.,noun,noun: singular lemma,,T2,0.333,7.99,media,high_frequency + dispersion,المقيم; المقيمة; المقيمون; المقيمين; مقيم ...,
2101,غَنِيّ,ganiy~,I'm rich.,adj,adj: masc singular lemma,,T2,0.333,7.99,media,high_frequency + dispersion,أغنى; أغنياء; الأغنياء; الاغنياء; الغنى ...,
2102,عَلامَة,EalAmap,A sign.,noun,noun: singular lemma,علم,T2,0.333,7.989,media,high_frequency + dispersion,العلامات; العلامة; علامات; علامة; وعلامات,
2103,فَسَّر,fas~ar,Explain.,verb,verb: 3ms past lemma,فسر,T2,0.333,7.988,media,high_frequency + dispersion,تفسر; فسر; نفسر; وفسر; ويفسر ...,
2104,ثامِن,vAmin,Eight.,adj,adj: masc singular lemma,ثمن,T2,0.333,7.986,media,high_frequency + dispersion,الثامن; الثامنة; والثامن,
2105,وِساطَة,wisATap,And a flat.,noun,noun: singular lemma,,T2,0.333,7.985,media,high_frequency + dispersion,الوساطات; الوساطة; بوساطة; للوساطة; وساطة,
2106,نَفَع,nafaE,We benefit.,verb,verb: 3ms past lemma,نفع,T2,0.333,7.985,media,high_frequency + dispersion,النفع; بالنفع; تنفع; نفع; نفعا ...,
2107,أَحْدَث,>aHodav,I'm going to talk.,noun,noun: singular lemma,حدث,T2,0.333,7.985,media,high_frequency + dispersion,أحدث; أحدثت; أحدثها; احدث; الأحدث ...,
2108,بلِير,bliyr,Blair.,noun_prop,noun: singular lemma,,T2,0.333,7.983,media,high_frequency + dispersion,بلير,
2109,كُونْدُولِيزا,kuwnoduwliyzA,I'm not going to be able to do this.,noun_prop,noun: singular lemma,,T2,0.333,7.983,media,high_frequency + dispersion,كوندوليزا,
2110,مِرْوَحِيَّة,mirowaHiy~ap,The spirit,noun,noun: singular lemma,,T2,0.333,7.983,media,high_frequency + dispersion,المروحيات; المروحية; مروحيات; مروحية; والمروحيات ...,
2111,فَتْوَى,fatowaY,It's a little late.,noun,noun: singular lemma,,T2,0.333,7.981,media,high_frequency + dispersion,الفتاوى; الفتوى; فتاوى; فتواه; فتوى,
2112,ثُلْث,vulov,One third.,noun,noun: singular lemma,ثلث,T2,0.333,7.98,media,high_frequency + dispersion,الثلث; الثلثين; ثلث; ثلثي,
2113,ٱِنْتِماء,{inotimA',Be a member.,noun,noun: singular lemma,,T2,0.333,7.977,media,high_frequency + dispersion,الانتماء; الانتماءات; انتماء; انتماءاتهم; انتمائه ...,
2114,له،,lh،,To him,noun_prop,noun: singular lemma,,T2,0.333,7.976,media,high_frequency + dispersion,له،,
2115,ٱِسْتِفْتاء,{isotifotA',Get out of here.,noun,noun: singular lemma,,T2,0.333,7.975,media,high_frequency + dispersion,استفتاء; الإستفتاء; الاستفتاء; للاستفتاء,
2116,أَدَب,>adab,Be polite.,noun,noun: singular lemma,,T2,0.333,7.975,media,high_frequency + dispersion,آداب; أدب; أدبي; الآداب; الأدب ...,
2117,ميركل,myrkl,- What?,noun_prop,noun: singular lemma,,T2,0.333,7.974,media,high_frequency + dispersion,ميركل,
2118,نِقابَة,niqAbap,A union.,noun,noun: singular lemma,نقب,T2,0.333,7.973,media,high_frequency + dispersion,النقابات; النقابة; نقابات; نقابة; والنقابات,
2119,تَوْحِيد,tawoHiyd,Unite.,noun,noun: singular lemma,,T2,0.333,7.972,media,high_frequency + dispersion,التوحيد; بتوحيد; توحيد; لتوحيد; وتوحيد,
2120,مالِك,mAlik,Your money.,noun,noun: singular lemma,ملك,T2,0.333,7.972,media,high_frequency + dispersion,المالك; المالكة; الملاك; مالك; مالكة ...,
2121,الجورجيه,Aljwrjyh,Georgian.,noun_prop,noun: singular lemma,,T2,0.333,7.971,media,high_frequency + dispersion,الجورجية,
2122,شَرّ,$ar~,It's bad.,noun,noun: singular lemma,شرر,T2,0.333,7.971,media,high_frequency + dispersion,الشر; الشرور; بشر; شر; شرا ...,
2123,ذَهاب,*ahAb,He's gone.,noun,noun: singular lemma,ذهب,T2,0.333,7.971,media,high_frequency + dispersion,الذهاب; بالذهاب; ذهاب; ذهابا; للذهاب ...,
2124,مَظْهَر,maZohar,It's showing.,noun,noun: singular lemma,ظهر,T2,0.333,7.971,media,high_frequency + dispersion,المظاهر; المظهر; بمظهر; مظاهر; مظهر ...,
2125,تَجاهُل,tajAhul,Ignore it.,noun,noun: singular lemma,جهل,T2,0.333,7.971,media,high_frequency + dispersion,التجاهل; بتجاهل; تتجاهل; تجاهل; تجاهلت ...,
2126,تَصْفِيَة,taSofiyap,Clearing up,noun,noun: singular lemma,,T2,0.333,7.969,media,high_frequency + dispersion,التصفيات; التصفية; بتصفية; تصفيات; تصفية ...,
2127,رَصاص,raSAS,Bullets.,noun,noun: singular lemma,رصص,T2,0.333,7.968,media,high_frequency + dispersion,الرصاص; بالرصاص; برصاص; رصاص,
2128,مُعامَلَة,muEAmalap,Deal with it.,noun,noun: singular lemma,عمل,T2,0.333,7.968,media,high_frequency + dispersion,المعاملات; المعاملة; معاملات; معاملة; معاملته ...,
2129,فيها،,fyhA،,In it,noun_prop,noun: singular lemma,,T2,0.333,7.968,media,high_frequency + dispersion,فيها،,
2130,سِلْعَة,siloEap,- What?,noun,noun: singular lemma,سلع,T2,0.333,7.967,media,high_frequency + dispersion,السلع; السلعة; سلع; سلعة; للسلع ...,
2131,ذاكَ,*Aka,That one.,pron_dem,particle/base,,T2,0.333,7.966,media,high_frequency + dispersion,ذاك; وذاك,
2132,مُوالِي,muwAliy,My loyalist.,noun,noun: singular lemma,,T2,0.333,7.965,media,high_frequency + dispersion,الموالي; الموالية; الموالين; موال; موالون ...,
2133,أَسْبَق,>asobaq,- I did.,noun,noun: singular lemma,سبق,T2,0.333,7.963,media,high_frequency + dispersion,الأسبق; الاسبق,
2134,إِقْناع,<iqonAE,Convince me.,noun,noun: singular lemma,قنع,T2,0.333,7.963,media,high_frequency + dispersion,إقناع; اقناع; الإقناع; لإقناع; لاقناع,
2135,سامِي,sAmiy,Sammy.,noun_prop,noun: singular lemma,,T2,0.333,7.962,media,high_frequency + dispersion,السامي; السامية; سامي; سامية,
2136,هادِئ,hAdi},- Calm down.,noun_prop,noun: singular lemma,,T2,0.333,7.96,media,high_frequency + dispersion,الهادئ; الهادئة; الهادي; هادئ; هادئا ...,
2137,مُتَخَصِّص,mutaxaS~iS,Specifically,adj,adj: masc singular lemma,خصص,T2,0.333,7.96,media,high_frequency + dispersion,المتخصص; المتخصصة; المتخصصين; متخصص; متخصصة ...,
2138,ٱِكْتِشاف,{ikoti$Af,Discover it.,noun,noun: singular lemma,كشف,T2,0.333,7.958,media,high_frequency + dispersion,اكتشاف; اكتشافه; اكتشافها; الاكتشاف; الاكتشافات ...,
2139,مُناوَرَة,munAwarap,- I'm not.,noun,noun: singular lemma,,T2,0.333,7.958,media,high_frequency + dispersion,المناورات; المناورة; بمناورات; مناورات; مناورة,
2140,حزيران/يونيو,HzyrAn/ywnyw,June,noun_prop,noun: singular lemma,,T2,0.333,7.956,media,high_frequency + dispersion,حزيران/يونيو,
2141,تَضَخُّم,taDax~um,It's getting bigger.,noun,noun: singular lemma,ضخم,T2,0.333,7.956,media,high_frequency + dispersion,التضخم; تضخم; والتضخم,
2142,مَنْطِق,manoTiq,It makes sense.,noun,noun: singular lemma,نطق,T2,0.333,7.956,media,high_frequency + dispersion,المنطق; بمنطق; لمنطق; منطق; والمنطق ...,
2143,تاسِع,tAsiE,Nine.,adj,adj: masc singular lemma,تسع,T2,0.333,7.956,media,high_frequency + dispersion,التاسع; التاسعة; والتاسع,
2144,بها،,bhA،,With her,noun_prop,noun: singular lemma,,T2,0.333,7.955,media,high_frequency + dispersion,بها،,
2145,مُنافِس,munAfis,Competitors.,noun,noun: singular lemma,نفس,T2,0.333,7.951,media,high_frequency + dispersion,المنافس; المنافسين; منافس; منافسا; منافسه ...,
2146,حَقْل,Haqol,A field.,noun,noun: singular lemma,حقل,T2,0.333,7.951,media,high_frequency + dispersion,الحقل; الحقول; حقل; حقول,
2147,مُعَدّات,muEad~At,The equipment,noun,noun: singular lemma,عدد,T2,0.333,7.95,media,high_frequency + dispersion,المعدات; بمعدات; معدات; والمعدات; ومعدات,
2148,أَنْشَأ,>ano$a>,I created,verb,verb: 3ms past lemma,,T2,0.333,7.949,media,high_frequency + dispersion,أنشأ; أنشأت; أنشئ; أنشئت; انشئت ...,
2149,تَحْذِير,taHo*iyr,Warning.,noun,noun: singular lemma,حذر,T2,0.333,7.949,media,high_frequency + dispersion,التحذير; التحذيرات; تحذير; تحذيرا; تحذيرات ...,
2150,تَدَهْوُر,tadahowur,It's getting worse.,noun,noun: singular lemma,دهر,T2,0.333,7.947,media,high_frequency + dispersion,التدهور; تتدهور; تدهور; تدهورا; تدهورت ...,
2151,حِدَّة,Hid~ap,A bit of a shock.,noun,noun: singular lemma,حدد,T2,0.333,7.946,media,high_frequency + dispersion,الحدة; بحدة; حدة; حدتها,
2152,ٱِحْتَجَز,{iHotajaz,Hold on.,verb,verb: 3ms past lemma,حجز,T2,0.333,7.946,media,high_frequency + dispersion,احتجز; احتجزت; احتجزوا; تحتجز; تحتجزهم ...,
2153,نَهْج,nahoj,We're going to get a ride.,noun,noun: singular lemma,نهج,T2,0.333,7.945,media,high_frequency + dispersion,النهج; لنهج; نهج; نهجا; نهجاً ...,
2154,نَزْع,nazoE,We're taking it off.,noun,noun: singular lemma,نزع,T2,0.333,7.945,media,high_frequency + dispersion,بنزع; تنزع; لنزع; نزع; ونزع ...,
2155,سافَر,sAfar,A traveler.,verb,verb: 3ms past lemma,سفر,T2,0.333,7.944,media,high_frequency + dispersion,السافر; تسافر; سافر; سافرت; يسافر ...,
2156,ضَرّ,Dar~,It hurt.,verb,verb: 3ms past lemma,ضرر,T2,0.333,7.943,media,high_frequency + dispersion,أضر; تضر; تضرر; يضر,
2157,أَوْحَى,>awoHaY,He's been steered.,verb,verb: 3ms past lemma,,T2,0.333,7.943,media,high_frequency + dispersion,أوحى; توحي; يوحنا; يوحي,
2158,تَصاعُد,taSAEud,It's going up.,noun,noun: singular lemma,صعد,T2,0.333,7.942,media,high_frequency + dispersion,تتصاعد; تصاعد; تصاعدت; وتصاعد; وتصاعدت ...,
2159,مُؤَلِّف,mu&al~if,Author,noun,noun: singular lemma,,T2,0.333,7.942,media,high_frequency + dispersion,المؤلف; المؤلفات; المؤلفة; المؤلفين; مؤلف ...,
2160,البلاد،,AlblAd،,The country,noun_prop,noun: singular lemma,,T2,0.333,7.941,media,high_frequency + dispersion,البلاد،,
2161,نُخْبَة,nuxobap,The Scouts.,noun,noun: singular lemma,نخب,T2,0.333,7.941,media,high_frequency + dispersion,النخب; النخبة; نخب; نخبة; والنخب,
2162,عَفْو,Eafow,I'm sorry.,noun,noun: singular lemma,,T2,0.333,7.94,media,high_frequency + dispersion,العفو; بالعفو; عفو; عفوا; والعفو,
2163,تَقْسِيم,taqosiym,Split up.,noun,noun: singular lemma,قسم,T2,0.333,7.94,media,high_frequency + dispersion,التقسيم; التقسيمات; بتقسيم; تقسيم; لتقسيم ...,
2164,نُصْب,nuSob,We're standing up.,noun,noun: singular lemma,نصب,T2,0.333,7.94,media,high_frequency + dispersion,النصب; بنصب; تنصب; نصب; نصبت ...,
2165,تَوازُن,tawAzun,Balance.,noun,noun: singular lemma,,T2,0.333,7.94,media,high_frequency + dispersion,التوازن; التوازنات; بالتوازن; توازن; توازنات ...,
2166,رِياضَة,riyADap,- I'm not.,noun,noun: singular lemma,,T2,0.333,7.94,media,high_frequency + dispersion,الرياضة; رياضة; للرياضة; والرياضة,
2167,ذاتِيّ,*Atiy~,My own.,adj,adj: masc singular lemma,,T2,0.333,7.939,media,high_frequency + dispersion,الذاتي; الذاتية; ذاتي; ذاتيا; ذاتية,
2168,ٱِنْعِقاد,{inoEiqAd,Hold on.,noun,noun: singular lemma,عقد,T2,0.333,7.938,media,high_frequency + dispersion,الانعقاد; انعقاد; انعقاده; انعقادها; لانعقاد,
2169,أَفْرَج,>aforaj,Let go.,verb,verb: 3ms past lemma,فرج,T2,0.333,7.937,media,high_frequency + dispersion,أفرج; أفرجت; افرج; افرجت; تفرج ...,
2170,تَوْصِيَة,tawoSiyap,A recommendation.,noun,noun: singular lemma,,T2,0.333,7.936,media,high_frequency + dispersion,التوصيات; التوصية; بتوصيات; توصيات; توصياتها ...,
2171,مُناخ,munAx,The climate.,noun,noun: singular lemma,,T2,0.333,7.936,media,high_frequency + dispersion,المناخ; المناخات; مناخ; مناخات; والمناخ,
2172,أَمان,>amAn,It's safe.,noun,noun: singular lemma,,T2,0.333,7.936,media,high_frequency + dispersion,أمان; أماني; الأمان; الامان; امان ...,
2173,مُتَقَدِّم,mutaqad~im,- In front of you.,adj,adj: masc singular lemma,قدم,T2,0.333,7.935,media,high_frequency + dispersion,المتقدم; المتقدمة; المتقدمين; متقدم; متقدما ...,
2174,آباد,|bAd,I'm sorry.,noun_prop,noun: singular lemma,,T2,0.333,7.935,media,high_frequency + dispersion,آباد; أباد; اباد,
2175,دِرْع,diroE,Shield.,noun,noun: singular lemma,درع,T2,0.333,7.934,media,high_frequency + dispersion,الدرع; الدروع; درع; درعا; للدروع,
2176,إِيمان,<iymAn,Faith.,noun,noun: singular lemma,,T2,0.333,7.934,media,high_frequency + dispersion,إيمان; إيمانا; إيماناً; إيمانه; الإيمان ...,
2177,تَسَنَّى,tasan~aY,- You're welcome.,verb,verb: 3ms past lemma,,T2,0.333,7.934,media,high_frequency + dispersion,تسنى; ليتسنى; يتسن; يتسنى,
2178,صَلاح,SalAH,Right.,noun_prop,noun: singular lemma,صلح,T2,0.333,7.933,media,high_frequency + dispersion,صلاح; والصلاح; وصلاح,
2179,ٱِحْتَفَل,{iHotafal,Celebrate.,verb,verb: 3ms past lemma,حفل,T2,0.333,7.932,media,high_frequency + dispersion,احتفل; احتفلت; تحتفل; نحتفل; يحتفل ...,
2180,ضاحِيَة,DAHiyap,Suburbs.,noun,noun: singular lemma,,T2,0.333,7.931,media,high_frequency + dispersion,الضاحية; الضواحي; بضاحية; بضواحي; ضاحية ...,
2181,مَفْرُوض,maforuwD,It's all right.,adj,adj: masc singular lemma,فرض,T2,0.333,7.93,media,high_frequency + dispersion,المفروض; المفروضة; مفروض; مفروضة; والمفروض,
2182,أَدْنَى,>adonaY,I'm down.,noun,noun: singular lemma,,T2,0.333,7.929,media,high_frequency + dispersion,أدان; ادنى; الأدنى; الادنى; وأدان,
2183,مَنْهَج,manohaj,The approach,noun,noun: singular lemma,نهج,T2,0.333,7.929,media,high_frequency + dispersion,المناهج; المنهج; مناهج; منهج; منهجا ...,
2184,إِدانَة,<idAnap,Conviction.,noun,noun: singular lemma,,T2,0.333,7.928,media,high_frequency + dispersion,إدانة; إدانته; إدانتهم; ادانة; ادانته ...,
2185,مُقَدَّم,muqad~am,- What?,adj,adj: masc singular lemma,قدم,T2,0.333,7.927,media,high_frequency + dispersion,المقدم; المقدمة; مقدم; مقدما; مقدمها ...,
2186,عِيان,EiyAn,Eyes.,noun,noun: singular lemma,,T2,0.333,7.924,media,high_frequency + dispersion,العيان; عيان; للعيان,
2187,قابِل,qAbil,Get in touch.,adj,adj: masc singular lemma,قبل,T2,0.333,7.924,media,high_frequency + dispersion,القابل; القابلة; تقابل; قابل; قابلا ...,
2188,الفلسطينيه،,AlflsTynyh،,The Palestinian,noun_prop,noun: singular lemma,,T2,0.333,7.924,media,high_frequency + dispersion,الفلسطينية،,
2189,مُساواة,musAwAp,Equality.,noun,noun: singular lemma,,T2,0.333,7.924,media,high_frequency + dispersion,المساواة; بالمساواة; مساواة; والمساواة,
2190,تِلفِزيُونِيّ,tilfizyuwniy~,I'm on TV.,adj,adj: masc singular lemma,,T2,0.333,7.923,media,high_frequency + dispersion,التلفزيوني; التلفزيونية; التليفزيونية; تلفزيوني; تلفزيونية ...,
2191,عادِيّ,EAdiy~,I'm normal.,adj,adj: masc singular lemma,,T2,0.333,7.922,media,high_frequency + dispersion,العادي; العادية; العاديين; عادي; عاديا ...,
2192,ضَخْم,Daxom,It's huge.,adj,adj: masc singular lemma,ضخم,T2,0.333,7.922,media,high_frequency + dispersion,أضخم; الضخم; الضخمة; ضخم; ضخما ...,
2193,تَداعِي,tadAEiy,I'm falling.,noun,noun: singular lemma,,T2,0.333,7.922,media,high_frequency + dispersion,التداعيات; تداعيات; تداعياتها; وتداعيات; وتداعياته ...,
2194,رَشَّح,ra$~aH,He's nominated.,verb,verb: 3ms past lemma,رشح,T2,0.333,7.921,media,high_frequency + dispersion,ترشح; ترشحه; رشح; رشحت; يرشح,
2195,مُفاعِل,mufAEil,Reactors.,noun,noun: singular lemma,فعل,T2,0.333,7.92,media,high_frequency + dispersion,المفاعل; المفاعلات; مفاعل; مفاعلا; مفاعلات ...,
2196,ظُلْم,Zulom,I was wronged.,noun,noun: singular lemma,ظلم,T2,0.333,7.919,media,high_frequency + dispersion,الظلم; بالظلم; ظلم; ظلما; للظلم ...,
2197,الدوليه،,Aldwlyh،,The international,noun_prop,noun: singular lemma,,T2,0.333,7.917,media,high_frequency + dispersion,الدولية،,
2198,جِدَّة,jid~ap,- What?,noun,noun: singular lemma,جدد,T2,0.333,7.917,media,high_frequency + dispersion,جدة,
2199,ٱِنْعَقَد,{inoEaqad,It's complicated.,verb,verb: 3ms past lemma,عقد,T2,0.333,7.916,media,high_frequency + dispersion,انعقد; انعقدت; تنعقد; سينعقد; ينعقد,
2200,عليه،,Elyh،,It's on him.,noun_prop,noun: singular lemma,,T2,0.333,7.916,media,high_frequency + dispersion,عليه،,
2201,أُولائِكَ,>uwlA}ika,Your superiors.,pron_dem,particle/base,,T2,0.333,7.916,media,high_frequency + dispersion,أولئك; اولئك; لأولئك; وأولئك,
2202,حامِل,HAmil,She's pregnant.,noun,noun: singular lemma,حمل,T2,0.333,7.915,media,high_frequency + dispersion,الحامل; الحاملة; الحوامل; حامل; حاملا ...,
2203,هائِل,hA}il,Oh; that's awesome.,adj,adj: masc singular lemma,,T2,0.333,7.914,media,high_frequency + dispersion,الهائل; الهائلة; هائل; هائلا; هائلاً ...,
2204,بِضْع,biDoE,- A few.,noun,noun: singular lemma,بضع,T2,0.333,7.914,media,high_frequency + dispersion,بضع; بضعة; لبضع; لبضعة,
2205,رَحْمٰن,raHom`n,Oh; my God.,noun_prop,noun: singular lemma,رحم,T2,0.333,7.912,media,high_frequency + dispersion,الرحمن; رحمان; رحمن,
2206,رَشِيد,ra$iyd,Rashid.,noun_prop,noun: singular lemma,رشد,T2,0.333,7.912,media,high_frequency + dispersion,الرشيد; الرشيدة; رشيد; رشيدة,
2207,تَصْعِيد,taSoEiyd,Going up.,noun,noun: singular lemma,صعد,T2,0.333,7.912,media,high_frequency + dispersion,التصعيد; بتصعيد; تصعيد; تصعيدا; لتصعيد ...,
2208,تَجْهِيز,tajohiyz,Get ready.,noun,noun: singular lemma,جهز,T2,0.333,7.911,media,high_frequency + dispersion,التجهيز; التجهيزات; بتجهيز; تجهيز; تجهيزات ...,
2209,فَحْص,faHoS,Check it out.,noun_prop,noun: singular lemma,فحص,T2,0.333,7.909,media,high_frequency + dispersion,الفحص; الفحوص; الفحوصات; بفحص; فحص ...,
2210,مُماثِل,mumAvil,It's like that.,adj,adj: masc singular lemma,مثل,T2,0.333,7.909,media,high_frequency + dispersion,المماثل; المماثلة; مماثل; مماثلا; مماثلاً ...,
2211,تَوْفِيق,tawofiyq,It's okay.,noun,noun: singular lemma,,T2,0.333,7.909,media,high_frequency + dispersion,التوفيق; بالتوفيق; توفيق; والتوفيق; وبالتوفيق,
2212,عائِد,EA}id,Get back in there.,noun,noun: singular lemma,,T2,0.333,7.909,media,high_frequency + dispersion,العائد; العائدات; العائدة; العائدين; عائد ...,
2213,مُصاب,muSAb,He's hurt.,adj,adj: masc singular lemma,,T2,0.333,7.908,media,high_frequency + dispersion,المصاب; المصابة; المصابين; مصاب; مصابا ...,
2214,حَدا,HadA,No one.,verb,verb: 3ms past lemma,,T2,0.333,7.907,media,high_frequency + dispersion,حدا; حداً,
2215,رَهِينَة,rahiynap,Hostage.,noun,noun: singular lemma,رهن,T2,0.333,7.905,media,high_frequency + dispersion,الرهائن; الرهينتين; رهائن; رهينة; كرهائن,
2216,تَوَسُّع,tawas~uE,It expands.,noun,noun: singular lemma,,T2,0.333,7.904,media,high_frequency + dispersion,التوسع; تتوسع; توسع; توسعة; توسعت ...,
2217,وازَى,wAzaY,I'm going to go.,verb,verb: 3ms past lemma,,T2,0.333,7.902,media,high_frequency + dispersion,توازي; نواز; يوازي,
2218,مَجْمُوع,majomuwE,All together.,noun,noun: singular lemma,جمع,T2,0.333,7.902,media,high_frequency + dispersion,المجموع; بمجموع; مجموع; مجموعته; مجموعه ...,
2219,سائِح,sA}iH,Tourist.,noun,noun: singular lemma,,T2,0.333,7.901,media,high_frequency + dispersion,السائح; السائحين; السياح; سائح; سائحا ...,
2220,كَسْر,kasor,It's broken.,noun,noun: singular lemma,كسر,T2,0.333,7.9,media,high_frequency + dispersion,بكسر; تكسر; كسر; كسرت; لكسر ...,
2221,حافِظ,HAfiZ,Keep it.,noun_prop,noun: singular lemma,حفظ,T2,0.333,7.9,media,high_frequency + dispersion,الحافظ; تحافظ; حافظ; حافظت; نحافظ ...,
2222,تاجِر,tAjir,A businessman.,noun,noun: singular lemma,تجر,T2,0.333,7.899,media,high_frequency + dispersion,التاجر; التجار; تاجر; تجار; والتجار ...,
2223,مَهَّد,mah~ad,He's a man.,verb,verb: 3ms past lemma,مهد,T2,0.333,7.899,media,high_frequency + dispersion,المهد; تمهد; مهد; مهدت; يمهد,
2224,لادِن,lAdin,Laden.,noun_prop,noun: singular lemma,لدن,T2,0.333,7.899,media,high_frequency + dispersion,لادن,
2225,إِنْفاق,<inofAq,Tunnels.,noun,noun: singular lemma,نفق,T2,0.333,7.899,media,high_frequency + dispersion,أنفاق; إنفاق; الإنفاق; الانفاق; انفاق,
2226,ناسِف,nAsif,It's a bomb.,adj,adj: masc singular lemma,نسف,T2,0.333,7.898,media,high_frequency + dispersion,الناسفة; ناسفا; ناسفة; ناسفتين,
2227,تَضامُن,taDAmun,You're in.,noun,noun: singular lemma,ضمن,T2,0.333,7.897,media,high_frequency + dispersion,التضامن; تضامن; تضامنا; تضامنه; تضامنها ...,
2228,مَذْكُور,ma*okuwr,It's been mentioned.,adj,adj: masc singular lemma,ذكر,T2,0.333,7.897,media,high_frequency + dispersion,المذكور; المذكورة; المذكورين,
2229,طارِق,TAriq,The tarek.,noun_prop,noun: singular lemma,طرق,T2,0.333,7.895,media,high_frequency + dispersion,طارق; وطارق,
2230,خُرْطُوم,xuroTuwm,I got it.,noun,noun: singular lemma,خرطم,T2,0.333,7.892,media,high_frequency + dispersion,الخرطوم,
2231,تَقْلِيد,taqoliyd,I'm going to copy.,noun,noun: singular lemma,قلد,T2,0.333,7.892,media,high_frequency + dispersion,التقاليد; التقليد; تقاليد; تقليد; والتقاليد ...,
2232,فِيدْيُو,fiydoyuw,I'm going to get a video.,noun,noun: singular lemma,,T2,0.333,7.891,media,high_frequency + dispersion,الفيديو; فيديو,
2233,خَصْم,xaSom,Fight it.,noun,noun: singular lemma,خصم,T2,0.333,7.891,media,high_frequency + dispersion,الخصم; الخصوم; خصم; خصمه; خصوم ...,
2234,تَخْفِيض,taxofiyD,Lowering.,noun,noun: singular lemma,خفض,T2,0.333,7.89,media,high_frequency + dispersion,التخفيض; التخفيضات; بتخفيض; تخفيض; تخفيضات ...,
2235,عَقَبَة,Eaqabap,A bottleneck.,noun,noun: singular lemma,عقب,T2,0.333,7.889,media,high_frequency + dispersion,العقبات; العقبة; عقبات; عقبة; والعقبات,
2236,مُظاهَرَة,muZAharap,A demonstration.,noun,noun: singular lemma,ظهر,T2,0.333,7.889,media,high_frequency + dispersion,المظاهرات; المظاهرة; مظاهرات; مظاهرة,
2237,عاما،,EAmA،,A year,noun_prop,noun: singular lemma,,T2,0.333,7.889,media,high_frequency + dispersion,عاما،; عاماً،; عامًا،,
2238,نات,nAt,Nat; please.,verb,verb: 3ms past lemma,,T2,0.333,7.888,media,high_frequency + dispersion,نت,
2239,مِيزان,miyzAn,Weighs.,noun,noun: singular lemma,,T2,0.333,7.888,media,high_frequency + dispersion,الميزان; ميزان; ميزانية,
2240,مُشَدِّد,mu$ad~id,- It's a little tight.,adj,adj: masc singular lemma,شدد,T2,0.333,7.888,media,high_frequency + dispersion,المشددة; مشددا; مشدداً; مشددة; مشددًا,
2241,قَلَّل,qal~al,- Cut it down.,verb,verb: 3ms past lemma,قلل,T2,0.333,7.887,media,high_frequency + dispersion,تقلل; قلل; وقلل; يقلل,
2242,جِدِّيّ,jid~iy~,My grandfather.,adj,adj: masc singular lemma,جدد,T2,0.333,7.886,media,high_frequency + dispersion,الجدي; الجدية; جدي; جديا; جدياً ...,
2243,عَمالَة,EamAlap,Work.,noun,noun: singular lemma,عمل,T2,0.333,7.886,media,high_frequency + dispersion,العمالة; العماله; بالعمالة; عمالة; للعمالة ...,
