rank,arabic_lemma,transliteration,english_core_gloss,part_of_speech,canonical_form_rule_used,root_if_relevant,estimated_frequency_tier,dispersion_score,usefulness_score,register_label,keep_reason,merged_forms_or_variants,notes
2123,ذَهاب,*ahAb,He's gone.,noun,noun: singular lemma,ذهب,T2,0.333,7.971,media,high_frequency + dispersion,الذهاب; بالذهاب; ذهاب; ذهابا; للذهاب ...,
2124,مَظْهَر,maZohar,Appearance,noun,noun: singular lemma,ظهر,T2,0.333,7.971,media,high_frequency + dispersion,المظاهر; المظهر; بمظهر; مظاهر; مظهر ...,
2125,تَجاهُل,tajAhul,Ignore.,noun,noun: singular lemma,جهل,T2,0.333,7.971,media,high_frequency + dispersion,التجاهل; بتجاهل; تتجاهل; تجاهل; تجاهلت ...,
2126,تَصْفِيَة,taSofiyap,Physiology.,noun,noun: singular lemma,,T2,0.333,7.969,media,high_frequency + dispersion,التصفيات; التصفية; بتصفية; تصفيات; تصفية ...,
2127,رَصاص,raSAS,Bullets.,noun,noun: singular lemma,رصص,T2,0.333,7.968,media,high_frequency + dispersion,الرصاص; بالرصاص; برصاص; رصاص,
2128,مُعامَلَة,muEAmalap,A factor.,noun,noun: singular lemma,عمل,T2,0.333,7.968,media,high_frequency + dispersion,المعاملات; المعاملة; معاملات; معاملة; معاملته ...,
2129,فيها،,fyhA،,In it,noun_prop,noun: singular lemma,,T2,0.333,7.968,media,high_frequency + dispersion,فيها،,
2130,سِلْعَة,siloEap,Skin.,noun,noun: singular lemma,سلع,T2,0.333,7.967,media,high_frequency + dispersion,السلع; السلعة; سلع; سلعة; للسلع ...,
2131,ذاكَ,*Aka,That one.,pron_dem,particle/base,,T2,0.333,7.966,media,high_frequency + dispersion,ذاك; وذاك,
2132,مُوالِي,muwAliy,My loyal.,noun,noun: singular lemma,,T2,0.333,7.965,media,high_frequency + dispersion,الموالي; الموالية; الموالين; موال; موالون ...,
2133,أَسْبَق,>asobaq,I've been ahead of you.,noun,noun: singular lemma,سبق,T2,0.333,7.963,media,high_frequency + dispersion,الأسبق; الاسبق,
2134,إِقْناع,<iqonAE,Convince,noun,noun: singular lemma,قنع,T2,0.333,7.963,media,high_frequency + dispersion,إقناع; اقناع; الإقناع; لإقناع; لاقناع,
2135,سامِي,sAmiy,Sammy.,noun_prop,noun: singular lemma,,T2,0.333,7.962,media,high_frequency + dispersion,السامي; السامية; سامي; سامية,
2136,هادِئ,hAdi},Calm down.,noun_prop,noun: singular lemma,,T2,0.333,7.96,media,high_frequency + dispersion,الهادئ; الهادئة; الهادي; هادئ; هادئا ...,
2137,مُتَخَصِّص,mutaxaS~iS,Specialized,adj,adj: masc singular lemma,خصص,T2,0.333,7.96,media,high_frequency + dispersion,المتخصص; المتخصصة; المتخصصين; متخصص; متخصصة ...,
2138,ٱِكْتِشاف,{ikoti$Af,Discovery,noun,noun: singular lemma,كشف,T2,0.333,7.958,media,high_frequency + dispersion,اكتشاف; اكتشافه; اكتشافها; الاكتشاف; الاكتشافات ...,
2139,مُناوَرَة,munAwarap,A maneuver.,noun,noun: singular lemma,,T2,0.333,7.958,media,high_frequency + dispersion,المناورات; المناورة; بمناورات; مناورات; مناورة,
2140,حزيران/يونيو,HzyrAn/ywnyw,June,noun_prop,noun: singular lemma,,T2,0.333,7.956,media,high_frequency + dispersion,حزيران/يونيو,
2141,تَضَخُّم,taDax~um,Grow up.,noun,noun: singular lemma,ضخم,T2,0.333,7.956,media,high_frequency + dispersion,التضخم; تضخم; والتضخم,
2142,مَنْطِق,manoTiq,Perfect.,noun,noun: singular lemma,نطق,T2,0.333,7.956,media,high_frequency + dispersion,المنطق; بمنطق; لمنطق; منطق; والمنطق ...,
2143,تاسِع,tAsiE,IX,adj,adj: masc singular lemma,تسع,T2,0.333,7.956,media,high_frequency + dispersion,التاسع; التاسعة; والتاسع,
2144,بها،,bhA،,With them,noun_prop,noun: singular lemma,,T2,0.333,7.955,media,high_frequency + dispersion,بها،,
2145,مُنافِس,munAfis,Competing.,noun,noun: singular lemma,نفس,T2,0.333,7.951,media,high_frequency + dispersion,المنافس; المنافسين; منافس; منافسا; منافسه ...,
2146,حَقْل,Haqol,Knock it off.,noun,noun: singular lemma,حقل,T2,0.333,7.951,media,high_frequency + dispersion,الحقل; الحقول; حقل; حقول,
2147,مُعَدّات,muEad~At,Equipment,noun,noun: singular lemma,عدد,T2,0.333,7.95,media,high_frequency + dispersion,المعدات; بمعدات; معدات; والمعدات; ومعدات,
2148,أَنْشَأ,>ano$a>,I'm coming up.,verb,verb: 3ms past lemma,,T2,0.333,7.949,media,high_frequency + dispersion,أنشأ; أنشأت; أنشئ; أنشئت; انشئت ...,
2149,تَحْذِير,taHo*iyr,Look out!,noun,noun: singular lemma,حذر,T2,0.333,7.949,media,high_frequency + dispersion,التحذير; التحذيرات; تحذير; تحذيرا; تحذيرات ...,
2150,تَدَهْوُر,tadahowur,It's over. It's over. It's over. It's over,noun,noun: singular lemma,دهر,T2,0.333,7.947,media,high_frequency + dispersion,التدهور; تتدهور; تدهور; تدهورا; تدهورت ...,
2151,حِدَّة,Hid~ap,Bound.,noun,noun: singular lemma,حدد,T2,0.333,7.946,media,high_frequency + dispersion,الحدة; بحدة; حدة; حدتها,
2152,ٱِحْتَجَز,{iHotajaz,Hold on!,verb,verb: 3ms past lemma,حجز,T2,0.333,7.946,media,high_frequency + dispersion,احتجز; احتجزت; احتجزوا; تحتجز; تحتجزهم ...,
2153,نَهْج,nahoj,An approach.,noun,noun: singular lemma,نهج,T2,0.333,7.945,media,high_frequency + dispersion,النهج; لنهج; نهج; نهجا; نهجاً ...,
2154,نَزْع,nazoE,Take off.,noun,noun: singular lemma,نزع,T2,0.333,7.945,media,high_frequency + dispersion,بنزع; تنزع; لنزع; نزع; ونزع ...,
2155,سافَر,sAfar,Safar.,verb,verb: 3ms past lemma,سفر,T2,0.333,7.944,media,high_frequency + dispersion,السافر; تسافر; سافر; سافرت; يسافر ...,
2156,ضَرّ,Dar~,Damage.,verb,verb: 3ms past lemma,ضرر,T2,0.333,7.943,media,high_frequency + dispersion,أضر; تضر; تضرر; يضر,
2157,أَوْحَى,>awoHaY,He inspired...,verb,verb: 3ms past lemma,,T2,0.333,7.943,media,high_frequency + dispersion,أوحى; توحي; يوحنا; يوحي,
2158,تَصاعُد,taSAEud,Come on up.,noun,noun: singular lemma,صعد,T2,0.333,7.942,media,high_frequency + dispersion,تتصاعد; تصاعد; تصاعدت; وتصاعد; وتصاعدت ...,
2159,مُؤَلِّف,mu&al~if,Author,noun,noun: singular lemma,,T2,0.333,7.942,media,high_frequency + dispersion,المؤلف; المؤلفات; المؤلفة; المؤلفين; مؤلف ...,
2160,البلاد،,AlblAd،,Country,noun_prop,noun: singular lemma,,T2,0.333,7.941,media,high_frequency + dispersion,البلاد،,
2161,نُخْبَة,nuxobap,Toast.,noun,noun: singular lemma,نخب,T2,0.333,7.941,media,high_frequency + dispersion,النخب; النخبة; نخب; نخبة; والنخب,
2162,عَفْو,Eafow,Excuse me.,noun,noun: singular lemma,,T2,0.333,7.94,media,high_frequency + dispersion,العفو; بالعفو; عفو; عفوا; والعفو,
2163,تَقْسِيم,taqosiym,Split up.,noun,noun: singular lemma,قسم,T2,0.333,7.94,media,high_frequency + dispersion,التقسيم; التقسيمات; بتقسيم; تقسيم; لتقسيم ...,
2164,نُصْب,nuSob,Placing...,noun,noun: singular lemma,نصب,T2,0.333,7.94,media,high_frequency + dispersion,النصب; بنصب; تنصب; نصب; نصبت ...,
2165,تَوازُن,tawAzun,Balance.,noun,noun: singular lemma,,T2,0.333,7.94,media,high_frequency + dispersion,التوازن; التوازنات; بالتوازن; توازن; توازنات ...,
2166,رِياضَة,riyADap,Mathematics.,noun,noun: singular lemma,,T2,0.333,7.94,media,high_frequency + dispersion,الرياضة; رياضة; للرياضة; والرياضة,
2167,ذاتِيّ,*Atiy~,Self.,adj,adj: masc singular lemma,,T2,0.333,7.939,media,high_frequency + dispersion,الذاتي; الذاتية; ذاتي; ذاتيا; ذاتية,
2168,ٱِنْعِقاد,{inoEiqAd,Emancipation,noun,noun: singular lemma,عقد,T2,0.333,7.938,media,high_frequency + dispersion,الانعقاد; انعقاد; انعقاده; انعقادها; لانعقاد,
2169,أَفْرَج,>aforaj,Get out!,verb,verb: 3ms past lemma,فرج,T2,0.333,7.937,media,high_frequency + dispersion,أفرج; أفرجت; افرج; افرجت; تفرج ...,
2170,تَوْصِيَة,tawoSiyap,A command.,noun,noun: singular lemma,,T2,0.333,7.936,media,high_frequency + dispersion,التوصيات; التوصية; بتوصيات; توصيات; توصياتها ...,
2171,مُناخ,munAx,Climate,noun,noun: singular lemma,,T2,0.333,7.936,media,high_frequency + dispersion,المناخ; المناخات; مناخ; مناخات; والمناخ,
2172,أَمان,>amAn,Safe.,noun,noun: singular lemma,,T2,0.333,7.936,media,high_frequency + dispersion,أمان; أماني; الأمان; الامان; امان ...,
2173,مُتَقَدِّم,mutaqad~im,Advanced,adj,adj: masc singular lemma,قدم,T2,0.333,7.935,media,high_frequency + dispersion,المتقدم; المتقدمة; المتقدمين; متقدم; متقدما ...,
2174,آباد,|bAd,Abad.,noun_prop,noun: singular lemma,,T2,0.333,7.935,media,high_frequency + dispersion,آباد; أباد; اباد,
2175,دِرْع,diroE,Shield!,noun,noun: singular lemma,درع,T2,0.333,7.934,media,high_frequency + dispersion,الدرع; الدروع; درع; درعا; للدروع,
2176,إِيمان,<iymAn,Faith.,noun,noun: singular lemma,,T2,0.333,7.934,media,high_frequency + dispersion,إيمان; إيمانا; إيماناً; إيمانه; الإيمان ...,
2177,تَسَنَّى,tasan~aY,Squeeze.,verb,verb: 3ms past lemma,,T2,0.333,7.934,media,high_frequency + dispersion,تسنى; ليتسنى; يتسن; يتسنى,
2178,صَلاح,SalAH,Repair.,noun_prop,noun: singular lemma,صلح,T2,0.333,7.933,media,high_frequency + dispersion,صلاح; والصلاح; وصلاح,
2179,ٱِحْتَفَل,{iHotafal,Celebrate!,verb,verb: 3ms past lemma,حفل,T2,0.333,7.932,media,high_frequency + dispersion,احتفل; احتفلت; تحتفل; نحتفل; يحتفل ...,
2180,ضاحِيَة,DAHiyap,A suburb.,noun,noun: singular lemma,,T2,0.333,7.931,media,high_frequency + dispersion,الضاحية; الضواحي; بضاحية; بضواحي; ضاحية ...,
2181,مَفْرُوض,maforuwD,Imposed.,adj,adj: masc singular lemma,فرض,T2,0.333,7.93,media,high_frequency + dispersion,المفروض; المفروضة; مفروض; مفروضة; والمفروض,
2182,أَدْنَى,>adonaY,Down!,noun,noun: singular lemma,,T2,0.333,7.929,media,high_frequency + dispersion,أدان; ادنى; الأدنى; الادنى; وأدان,
2183,مَنْهَج,manohaj,Impressive.,noun,noun: singular lemma,نهج,T2,0.333,7.929,media,high_frequency + dispersion,المناهج; المنهج; مناهج; منهج; منهجا ...,
2184,إِدانَة,<idAnap,Convictions.,noun,noun: singular lemma,,T2,0.333,7.928,media,high_frequency + dispersion,إدانة; إدانته; إدانتهم; ادانة; ادانته ...,
2185,مُقَدَّم,muqad~am,Presented,adj,adj: masc singular lemma,قدم,T2,0.333,7.927,media,high_frequency + dispersion,المقدم; المقدمة; مقدم; مقدما; مقدمها ...,
2186,عِيان,EiyAn,Eyes.,noun,noun: singular lemma,,T2,0.333,7.924,media,high_frequency + dispersion,العيان; عيان; للعيان,
2187,قابِل,qAbil,Meet.,adj,adj: masc singular lemma,قبل,T2,0.333,7.924,media,high_frequency + dispersion,القابل; القابلة; تقابل; قابل; قابلا ...,
2188,الفلسطينيه،,AlflsTynyh،,The Palestinian,noun_prop,noun: singular lemma,,T2,0.333,7.924,media,high_frequency + dispersion,الفلسطينية،,
2189,مُساواة,musAwAp,Equivalent.,noun,noun: singular lemma,,T2,0.333,7.924,media,high_frequency + dispersion,المساواة; بالمساواة; مساواة; والمساواة,
2190,تِلفِزيُونِيّ,tilfizyuwniy~,Television me.,adj,adj: masc singular lemma,,T2,0.333,7.923,media,high_frequency + dispersion,التلفزيوني; التلفزيونية; التليفزيونية; تلفزيوني; تلفزيونية ...,
2191,عادِيّ,EAdiy~,Normal.,adj,adj: masc singular lemma,,T2,0.333,7.922,media,high_frequency + dispersion,العادي; العادية; العاديين; عادي; عاديا ...,
2192,ضَخْم,Daxom,Huge.,adj,adj: masc singular lemma,ضخم,T2,0.333,7.922,media,high_frequency + dispersion,أضخم; الضخم; الضخمة; ضخم; ضخما ...,
2193,تَداعِي,tadAEiy,Fuck off.,noun,noun: singular lemma,,T2,0.333,7.922,media,high_frequency + dispersion,التداعيات; تداعيات; تداعياتها; وتداعيات; وتداعياته ...,
2194,رَشَّح,ra$~aH,Nominated,verb,verb: 3ms past lemma,رشح,T2,0.333,7.921,media,high_frequency + dispersion,ترشح; ترشحه; رشح; رشحت; يرشح,
2195,مُفاعِل,mufAEil,Activate.,noun,noun: singular lemma,فعل,T2,0.333,7.92,media,high_frequency + dispersion,المفاعل; المفاعلات; مفاعل; مفاعلا; مفاعلات ...,
2196,ظُلْم,Zulom,Injustice.,noun,noun: singular lemma,ظلم,T2,0.333,7.919,media,high_frequency + dispersion,الظلم; بالظلم; ظلم; ظلما; للظلم ...,
2197,الدوليه،,Aldwlyh،,International,noun_prop,noun: singular lemma,,T2,0.333,7.917,media,high_frequency + dispersion,الدولية،,
2198,جِدَّة,jid~ap,Grandma.,noun,noun: singular lemma,جدد,T2,0.333,7.917,media,high_frequency + dispersion,جدة,
2199,ٱِنْعَقَد,{inoEaqad,Think of it.,verb,verb: 3ms past lemma,عقد,T2,0.333,7.916,media,high_frequency + dispersion,انعقد; انعقدت; تنعقد; سينعقد; ينعقد,
2200,عليه،,Elyh،,On it,noun_prop,noun: singular lemma,,T2,0.333,7.916,media,high_frequency + dispersion,عليه،,
2201,أُولائِكَ,>uwlA}ika,Yours.,pron_dem,particle/base,,T2,0.333,7.916,media,high_frequency + dispersion,أولئك; اولئك; لأولئك; وأولئك,
2202,حامِل,HAmil,Pregnant.,noun,noun: singular lemma,حمل,T2,0.333,7.915,media,high_frequency + dispersion,الحامل; الحاملة; الحوامل; حامل; حاملا ...,
2203,هائِل,hA}il,Wow.,adj,adj: masc singular lemma,,T2,0.333,7.914,media,high_frequency + dispersion,الهائل; الهائلة; هائل; هائلا; هائلاً ...,
2204,بِضْع,biDoE,A few.,noun,noun: singular lemma,بضع,T2,0.333,7.914,media,high_frequency + dispersion,بضع; بضعة; لبضع; لبضعة,
2205,رَحْمٰن,raHom`n,Merciful.,noun_prop,noun: singular lemma,رحم,T2,0.333,7.912,media,high_frequency + dispersion,الرحمن; رحمان; رحمن,
2206,رَشِيد,ra$iyd,Rush!,noun_prop,noun: singular lemma,رشد,T2,0.333,7.912,media,high_frequency + dispersion,الرشيد; الرشيدة; رشيد; رشيدة,
2207,تَصْعِيد,taSoEiyd,Coming up.,noun,noun: singular lemma,صعد,T2,0.333,7.912,media,high_frequency + dispersion,التصعيد; بتصعيد; تصعيد; تصعيدا; لتصعيد ...,
2208,تَجْهِيز,tajohiyz,Prepare.,noun,noun: singular lemma,جهز,T2,0.333,7.911,media,high_frequency + dispersion,التجهيز; التجهيزات; بتجهيز; تجهيز; تجهيزات ...,
2209,فَحْص,faHoS,Check.,noun_prop,noun: singular lemma,فحص,T2,0.333,7.909,media,high_frequency + dispersion,الفحص; الفحوص; الفحوصات; بفحص; فحص ...,
2210,مُماثِل,mumAvil,Perfect.,adj,adj: masc singular lemma,مثل,T2,0.333,7.909,media,high_frequency + dispersion,المماثل; المماثلة; مماثل; مماثلا; مماثلاً ...,
2211,تَوْفِيق,tawofiyq,Come on.,noun,noun: singular lemma,,T2,0.333,7.909,media,high_frequency + dispersion,التوفيق; بالتوفيق; توفيق; والتوفيق; وبالتوفيق,
2212,عائِد,EA}id,Come back.,noun,noun: singular lemma,,T2,0.333,7.909,media,high_frequency + dispersion,العائد; العائدات; العائدة; العائدين; عائد ...,
2213,مُصاب,muSAb,Injured.,adj,adj: masc singular lemma,,T2,0.333,7.908,media,high_frequency + dispersion,المصاب; المصابة; المصابين; مصاب; مصابا ...,
2214,حَدا,HadA,Oh; yeah.,verb,verb: 3ms past lemma,,T2,0.333,7.907,media,high_frequency + dispersion,حدا; حداً,
2215,رَهِينَة,rahiynap,A hostage.,noun,noun: singular lemma,رهن,T2,0.333,7.905,media,high_frequency + dispersion,الرهائن; الرهينتين; رهائن; رهينة; كرهائن,
2216,تَوَسُّع,tawas~uE,Expand,noun,noun: singular lemma,,T2,0.333,7.904,media,high_frequency + dispersion,التوسع; تتوسع; توسع; توسعة; توسعت ...,
2217,وازَى,wAzaY,Wazi.,verb,verb: 3ms past lemma,,T2,0.333,7.902,media,high_frequency + dispersion,توازي; نواز; يوازي,
2218,مَجْمُوع,majomuwE,Gathered.,noun,noun: singular lemma,جمع,T2,0.333,7.902,media,high_frequency + dispersion,المجموع; بمجموع; مجموع; مجموعته; مجموعه ...,
2219,سائِح,sA}iH,A tourist.,noun,noun: singular lemma,,T2,0.333,7.901,media,high_frequency + dispersion,السائح; السائحين; السياح; سائح; سائحا ...,
2220,كَسْر,kasor,Break,noun,noun: singular lemma,كسر,T2,0.333,7.9,media,high_frequency + dispersion,بكسر; تكسر; كسر; كسرت; لكسر ...,
2221,حافِظ,HAfiZ,Keep up.,noun_prop,noun: singular lemma,حفظ,T2,0.333,7.9,media,high_frequency + dispersion,الحافظ; تحافظ; حافظ; حافظت; نحافظ ...,
2222,تاجِر,tAjir,Trader,noun,noun: singular lemma,تجر,T2,0.333,7.899,media,high_frequency + dispersion,التاجر; التجار; تاجر; تجار; والتجار ...,
2223,مَهَّد,mah~ad,Slow down.,verb,verb: 3ms past lemma,مهد,T2,0.333,7.899,media,high_frequency + dispersion,المهد; تمهد; مهد; مهدت; يمهد,
2224,لادِن,lAdin,Laden.,noun_prop,noun: singular lemma,لدن,T2,0.333,7.899,media,high_frequency + dispersion,لادن,
2225,إِنْفاق,<inofAq,Spend.,noun,noun: singular lemma,نفق,T2,0.333,7.899,media,high_frequency + dispersion,أنفاق; إنفاق; الإنفاق; الانفاق; انفاق,
2226,ناسِف,nAsif,Bomb!,adj,adj: masc singular lemma,نسف,T2,0.333,7.898,media,high_frequency + dispersion,الناسفة; ناسفا; ناسفة; ناسفتين,
2227,تَضامُن,taDAmun,Get involved.,noun,noun: singular lemma,ضمن,T2,0.333,7.897,media,high_frequency + dispersion,التضامن; تضامن; تضامنا; تضامنه; تضامنها ...,
2228,مَذْكُور,ma*okuwr,Reminder.,adj,adj: masc singular lemma,ذكر,T2,0.333,7.897,media,high_frequency + dispersion,المذكور; المذكورة; المذكورين,
2229,طارِق,TAriq,Knock it off.,noun_prop,noun: singular lemma,طرق,T2,0.333,7.895,media,high_frequency + dispersion,طارق; وطارق,
2230,خُرْطُوم,xuroTuwm,Maps.,noun,noun: singular lemma,خرطم,T2,0.333,7.892,media,high_frequency + dispersion,الخرطوم,
2231,تَقْلِيد,taqoliyd,Crystal.,noun,noun: singular lemma,قلد,T2,0.333,7.892,media,high_frequency + dispersion,التقاليد; التقليد; تقاليد; تقليد; والتقاليد ...,
2232,فِيدْيُو,fiydoyuw,Vidio.,noun,noun: singular lemma,,T2,0.333,7.891,media,high_frequency + dispersion,الفيديو; فيديو,
2233,خَصْم,xaSom,Demolition.,noun,noun: singular lemma,خصم,T2,0.333,7.891,media,high_frequency + dispersion,الخصم; الخصوم; خصم; خصمه; خصوم ...,
2234,تَخْفِيض,taxofiyD,Slow down.,noun,noun: singular lemma,خفض,T2,0.333,7.89,media,high_frequency + dispersion,التخفيض; التخفيضات; بتخفيض; تخفيض; تخفيضات ...,
2235,عَقَبَة,Eaqabap,Hang on.,noun,noun: singular lemma,عقب,T2,0.333,7.889,media,high_frequency + dispersion,العقبات; العقبة; عقبات; عقبة; والعقبات,
2236,مُظاهَرَة,muZAharap,Appearance.,noun,noun: singular lemma,ظهر,T2,0.333,7.889,media,high_frequency + dispersion,المظاهرات; المظاهرة; مظاهرات; مظاهرة,
2237,عاما،,EAmA،,A year,noun_prop,noun: singular lemma,,T2,0.333,7.889,media,high_frequency + dispersion,عاما،; عاماً،; عامًا،,
2238,نات,nAt,Nat.,verb,verb: 3ms past lemma,,T2,0.333,7.888,media,high_frequency + dispersion,نت,
2239,مِيزان,miyzAn,Balance,noun,noun: singular lemma,,T2,0.333,7.888,media,high_frequency + dispersion,الميزان; ميزان; ميزانية,
2240,مُشَدِّد,mu$ad~id,Stressed,adj,adj: masc singular lemma,شدد,T2,0.333,7.888,media,high_frequency + dispersion,المشددة; مشددا; مشدداً; مشددة; مشددًا,
2241,قَلَّل,qal~al,Less,verb,verb: 3ms past lemma,قلل,T2,0.333,7.887,media,high_frequency + dispersion,تقلل; قلل; وقلل; يقلل,
2242,جِدِّيّ,jid~iy~,Find me.,adj,adj: masc singular lemma,جدد,T2,0.333,7.886,media,high_frequency + dispersion,الجدي; الجدية; جدي; جديا; جدياً ...,
2243,عَمالَة,EamAlap,Work.,noun,noun: singular lemma,عمل,T2,0.333,7.886,media,high_frequency + dispersion,العمالة; العماله; بالعمالة; عمالة; للعمالة ...,
2244,تَزامُن,tazAmun,Synchronize.,noun,noun: singular lemma,زمن,T2,0.333,7.884,media,high_frequency + dispersion,بالتزامن; تتزامن; تزامن; تزامنا; تزامنت ...,
2245,حَكِيم,Hakiym,Hakeem.,noun_prop,noun: singular lemma,حكم,T2,0.333,7.882,media,high_frequency + dispersion,الحكماء; الحكيم; الحكيمة; حكماء; حكيم ...,
2246,جِنْس,jinos,Jens.,noun,noun: singular lemma,جنس,T2,0.333,7.882,media,high_frequency + dispersion,الأجناس; الجنس; الجنسين; جنس; للجنس ...,
2247,ٱِضْطِراب,{iDoTirAb,Squeeze!,noun,noun: singular lemma,ضرب,T2,0.333,7.882,media,high_frequency + dispersion,اضطراب; اضطرابات; الاضطراب; الاضطرابات; واضطرابات ...,
2248,الجورجي,Aljwrjy,Georgia,noun_prop,noun: singular lemma,,T2,0.333,7.88,media,high_frequency + dispersion,الجورجي,
2249,قَفَز,qafaz,Jump!,verb,verb: 3ms past lemma,قفز,T2,0.333,7.879,media,high_frequency + dispersion,القفز; تقفز; قفز; قفزة; قفزت ...,
2250,صَعِد,SaEid,Come up.,verb,verb: 3ms past lemma,صعد,T2,0.333,7.878,media,high_frequency + dispersion,تصعد; صعد; صعدت; وصعد; وصعدت ...,
2251,ٱِمْتِلاك,{imotilAk,Own,noun,noun: singular lemma,ملك,T2,0.333,7.877,media,high_frequency + dispersion,امتلاك; امتلاكه; امتلاكها; بامتلاك; لامتلاك ...,
2252,جَوْلان,jawolAn,Two tours.,noun_prop,noun: singular lemma,,T2,0.333,7.876,media,high_frequency + dispersion,الجولان; والجولان,
2253,قِبْطِيّ,qiboTiy~,My caps.,noun_prop,noun: singular lemma,قبط,T2,0.333,7.874,media,high_frequency + dispersion,أقباط; الأقباط; الاقباط; القبطي; القبطية ...,
2254,زايِد,zAyid,Zayed.,noun_prop,noun: singular lemma,,T2,0.333,7.873,media,high_frequency + dispersion,الزائد; الزائدة; زائد; زائدا; زائدة ...,
2255,أَحاط,>aHAT,Surrounded.,verb,verb: 3ms past lemma,,T2,0.333,7.873,media,high_frequency + dispersion,أحاط; أحاطت; تحيط; يحيط,
2256,مِقْدار,miqodAr,How much?,noun,noun: singular lemma,قدر,T2,0.333,7.872,media,high_frequency + dispersion,بمقدار; مقدار; مقداره; مقدارها,
2257,صِياغَة,SiyAgap,Drafting,noun,noun: singular lemma,,T2,0.333,7.872,media,high_frequency + dispersion,الصياغة; بصياغة; صياغة; صياغته; صياغتها ...,
2258,تَخَلُّص,taxal~uS,Finish.,noun,noun: singular lemma,خلص,T2,0.333,7.871,media,high_frequency + dispersion,التخلص; بالتخلص; تتخلص; تخلصت; للتخلص ...,
2259,مُجْرِم,mujorim,Guilty.,noun,noun: singular lemma,جرم,T2,0.333,7.871,media,high_frequency + dispersion,المجرم; المجرمة; المجرمون; المجرمين; مجرم ...,
2260,حَصِيلَة,HaSiylap,.........,noun,noun: singular lemma,حصل,T2,0.333,7.869,media,high_frequency + dispersion,الحصيلة; حصيلة,
2261,حَشْد,Ha$od,Crowd!,noun,noun: singular lemma,حشد,T2,0.333,7.869,media,high_frequency + dispersion,الحشد; الحشود; حشد; حشدت; حشود ...,
2262,فَراغ,farAg,Clear.,noun,noun: singular lemma,فرغ,T2,0.333,7.866,media,high_frequency + dispersion,الفراغ; فراغ; فراغا; والفراغ,
2263,مُدَّعِي,mud~aEiy,Pretend.,noun,noun: singular lemma,,T2,0.333,7.865,media,high_frequency + dispersion,المدعى; المدعي; المدعين; مدعي,
2264,عاشِر,EA$ir,♪ ♪ ♪ ♪ ♪ ♪ ♪ ♪ ♪,noun,noun: singular lemma,عشر,T2,0.333,7.864,media,high_frequency + dispersion,العاشر; العاشرة,
2265,نَجا,najA,He survived.,verb,verb: 3ms past lemma,,T2,0.333,7.863,media,high_frequency + dispersion,النجا; نجا; نجاة; نجت; ونجا ...,
2266,مُرْتَفَع,murotafaE,Up.,noun,noun: singular lemma,رفع,T2,0.333,7.863,media,high_frequency + dispersion,المرتفع; المرتفعات; المرتفعة; مرتفع; مرتفعا ...,
2267,حَجّ,Haj~,Alibi.,noun,noun: singular lemma,حجج,T2,0.333,7.862,media,high_frequency + dispersion,الحج; بالحج; حج; للحج,
