rank,arabic_lemma,transliteration,english_core_gloss,part_of_speech,canonical_form_rule_used,root_if_relevant,estimated_frequency_tier,dispersion_score,usefulness_score,register_label,keep_reason,merged_forms_or_variants,notes
1116,تَطَرَّق,taTar~aq,I got divorced.,verb,verb: 3ms past lemma,طرق,T2,0.333,8.871,media,high_frequency + dispersion,التطرق; تتطرق; تطرق; تطرقت; وتطرق ...,
1117,غالِبِيَّة,gAlibiy~ap,Mostly,noun,noun: singular lemma,غلب,T2,0.333,8.871,media,high_frequency + dispersion,الغالبية; بغالبية; غالبية; غالبيتها; غالبيتهم ...,
1118,إِعْداد,<iEodAd,Get ready.,noun,noun: singular lemma,عدد,T2,0.333,8.87,media,high_frequency + dispersion,إعداد; إعدادها; اعداد; الإعداد; الاعداد ...,
1119,تَحَمَّل,taHam~al,Hold on.,verb,verb: 3ms past lemma,حمل,T2,0.333,8.867,media,high_frequency + dispersion,بتحمل; تتحمل; تتحملها; تحملت; لتحمل ...,
1120,صادِر,SAdir,Take it.,adj,adj: masc singular lemma,صدر,T2,0.333,8.865,media,high_frequency + dispersion,الصادر; الصادرات; الصادرة; صادر; صادرات ...,
1121,لَمّا,lam~A,I never did.,conj,particle/base,لمم,T2,0.333,8.864,media,high_frequency + dispersion,فلما; ولما,
1122,إِنْهاء,<inohA',Finished.,noun,noun: singular lemma,,T2,0.333,8.862,media,high_frequency + dispersion,إنهاء; انهاء; بإنهاء; بانهاء; لإنهاء ...,
1123,مَهْرَجان,mahorajAn,A crowded,noun,noun: singular lemma,,T2,0.333,8.859,media,high_frequency + dispersion,المهرجان; المهرجانات; بمهرجان; للمهرجان; لمهرجان ...,
1124,عَدالَة,EadAlap,Justice.,noun,noun: singular lemma,عدل,T2,0.333,8.859,media,high_frequency + dispersion,العدالة; بالعدالة; بعدالة; عدالة; للعدالة ...,
1125,مَعْهَد,maEohad,A covenant.,noun,noun: singular lemma,عهد,T2,0.333,8.859,media,high_frequency + dispersion,المعاهد; المعهد; بالمعهد; بمعاهدة; بمعهد ...,
1126,دارْفُور,dArofuwr,Darfur.,noun_prop,noun: singular lemma,,T2,0.333,8.857,media,high_frequency + dispersion,بدارفور; دارفور; ودارفور,
1127,جائِزَة,jA}izap,A reward.,noun,noun: singular lemma,,T2,0.333,8.856,media,high_frequency + dispersion,الجائزة; الجوائز; بجائزة; جائزة; جوائز ...,
1128,مُؤَشِّر,mu&a$~ir,The indicator,noun,noun: singular lemma,,T2,0.333,8.856,media,high_frequency + dispersion,المؤشر; المؤشرات; للمؤشر; مؤشر; مؤشرا ...,
1129,ميدفيديف,mydfydyf,Medvedev.,noun_prop,noun: singular lemma,,T2,0.333,8.855,media,high_frequency + dispersion,ميدفيديف,
1130,عِلاج,EilAj,Treatment.,noun,noun: singular lemma,علج,T2,0.333,8.855,media,high_frequency + dispersion,العلاج; العلاجات; بعلاج; علاج; علاجا ...,
1131,شِراء,$irA',Buy it.,noun,noun: singular lemma,,T2,0.333,8.853,media,high_frequency + dispersion,الشراء; بشراء; شراء; شرائها; لشراء ...,
1132,هِنْد,hinod,India.,noun_prop,noun: singular lemma,هند,T2,0.333,8.851,media,high_frequency + dispersion,الهند; بالهند; للهند; هند; والهند,
1133,أَفْرِيقِيا,>aforiyqiyA,Africa.,noun_prop,noun: singular lemma,,T2,0.333,8.851,media,high_frequency + dispersion,أفريقيا; إفريقيا; افريقيا; وأفريقيا; وافريقيا,
1134,خَسِر,xasir,He lost.,verb,verb: 3ms past lemma,خسر,T2,0.333,8.85,media,high_frequency + dispersion,تخسر; خسر; خسرت; خسرنا; خسروا ...,
1135,صَحافَة,SaHAfap,The newspaper.,noun,noun: singular lemma,صحف,T2,0.333,8.85,media,high_frequency + dispersion,الصحافة; بالصحافة; صحافة; للصحافة; والصحافة,
1136,مُشارِك,mu$Arik,A co-worker.,noun,noun: singular lemma,شرك,T2,0.333,8.848,media,high_frequency + dispersion,المشارك; المشاركون; المشاركين; للمشاركين; مشارك ...,
1137,آلِيَّة,|liy~ap,A machine.,noun,noun: singular lemma,,T2,0.333,8.847,media,high_frequency + dispersion,آليات; آلية; الآليات; الآلية; الاليات ...,
1138,ٱِعْتِراف,{iEotirAf,Confess.,noun,noun: singular lemma,عرف,T2,0.333,8.846,media,high_frequency + dispersion,اعتراف; اعترافا; اعترافات; اعترافه; اعترافها ...,
1139,مُحاكَمَة,muHAkamap,Trial.,noun,noun: singular lemma,حكم,T2,0.333,8.846,media,high_frequency + dispersion,المحاكمات; المحاكمة; بمحاكمة; للمحاكمة; لمحاكمة ...,
1140,أَدار,>adAr,Running.,verb,verb: 3ms past lemma,,T2,0.333,8.846,media,high_frequency + dispersion,أدار; تدار; تدير; تديره; تديرها ...,
1141,صَنْع,SanoE,Made it.,noun,noun: singular lemma,صنع,T2,0.333,8.844,media,high_frequency + dispersion,الصنع; بصنع; تصنع; تصنعها; صنع ...,
1142,فاق,fAq,It's over.,verb,verb: 3ms past lemma,,T2,0.333,8.844,media,high_frequency + dispersion,تفوق; تفوقها; فاق; فاقت; وتفوق ...,
1143,مُنْتَج,munotaj,Produced.,noun,noun: singular lemma,نتج,T2,0.333,8.843,media,high_frequency + dispersion,المنتج; المنتجات; المنتجة; المنتجين; للمنتجات ...,
1144,سِيادَة,siyAdap,The mistress.,noun,noun: singular lemma,,T2,0.333,8.842,media,high_frequency + dispersion,السيادة; بالسيادة; بسيادة; سيادة; سيادته ...,
1145,عادَة,EAdap,It's normal.,noun,noun: singular lemma,,T2,0.333,8.841,media,high_frequency + dispersion,العادات; العادة; العوائد; عادات; عادة ...,
1146,كُرْدِسْتان,kurodisotAn,Two cards.,noun_prop,noun: singular lemma,,T2,0.333,8.84,media,high_frequency + dispersion,كردستان; كُردستان; لكردستان; وكردستان,
1147,صَفْقَة,Safoqap,A clap.,noun,noun: singular lemma,صفق,T2,0.333,8.84,media,high_frequency + dispersion,الصفقات; الصفقة; بصفقة; صفقات; صفقة ...,
1148,قارَب,qArab,A boat.,verb,verb: 3ms past lemma,قرب,T2,0.333,8.839,media,high_frequency + dispersion,أقاربه; القارب; القوارب; قارب; قاربت ...,
1149,نَجّاد,naj~Ad,A warrior.,noun_prop,noun: singular lemma,نجد,T2,0.333,8.839,media,high_frequency + dispersion,نجاد,
1150,قانُونِيّ,qAnuwniy~,Legal.,adj,adj: masc singular lemma,قنن,T2,0.333,8.837,media,high_frequency + dispersion,القانوني; القانونية; القانونيين; قانوني; قانونيا ...,
1151,قَوِيّ,qawiy~,Strong.,adj,adj: masc singular lemma,,T2,0.333,8.836,media,high_frequency + dispersion,أقوياء; الأقوياء; القوية; تقوى; تقوي ...,
1152,حَثّ,Hav~,Urge him.,verb,verb: 3ms past lemma,حثث,T2,0.333,8.835,media,high_frequency + dispersion,تحث; حث; حثت; لحث; وحث ...,
1153,ٱِنْخَفَض,{inoxafaD,Lower down.,verb,verb: 3ms past lemma,خفض,T2,0.333,8.833,media,high_frequency + dispersion,انخفض; انخفضت; تنخفض; سينخفض; وانخفض ...,
1154,حَفْل,Hafol,Party.,noun,noun: singular lemma,حفل,T2,0.333,8.833,media,high_frequency + dispersion,الحفل; بحفل; حفل; حفلا; حفلاً ...,
1155,ضَمان,DamAn,Guaranteed.,noun,noun: singular lemma,ضمن,T2,0.333,8.833,media,high_frequency + dispersion,الضمان; بضمان; ضمان; ضمانا; لضمان ...,
1156,رِيال,riyAl,Real.,noun,noun: singular lemma,,T2,0.333,8.833,media,high_frequency + dispersion,الريال; الريالات; ريال; ريالا; ريالات ...,
1157,مَعْرِض,maEoriD,Exposed,noun,noun: singular lemma,عرض,T2,0.333,8.832,media,high_frequency + dispersion,المعرض; المعرضة; للمعرض; لمعرض; معرض ...,
1158,داعِي,dAEiy,My call.,noun,noun: singular lemma,,T2,0.333,8.832,media,high_frequency + dispersion,الداعي; الداعية; الداعين; الدعاة; بداعي ...,
1159,جَيِّد,jay~id,- Good. - What?,adj,adj: masc singular lemma,,T2,0.333,8.831,media,high_frequency + dispersion,الجيد; الجيدة; جيد; جيدا; جيداً ...,
1160,ناتُو,nAtuw,It's not.,noun_prop,noun: singular lemma,,T2,0.333,8.83,media,high_frequency + dispersion,الناتو; للناتو; ناتو; والناتو,
1161,صِفَة,Sifap,Grade.,noun,noun: singular lemma,,T2,0.333,8.826,media,high_frequency + dispersion,الصفات; الصفة; بصفة; بصفته; بصفتها ...,
1162,شابّ,$Ab~,A young man.,noun,noun: singular lemma,شبب,T2,0.333,8.822,media,high_frequency + dispersion,الشاب; الشابين; الشبان; شاب; شابا ...,
1163,رُوح,ruwH,A ghost.,noun,noun: singular lemma,,T2,0.333,8.822,media,high_frequency + dispersion,أرواح; أرواحهم; ارواح; الأرواح; الارواح ...,
1164,ثَمانِي,vamAniy,Eight.,adj,adj: masc singular lemma,ثمن,T2,0.333,8.819,media,high_frequency + dispersion,الثماني; الثمانية; الثمانين; بثمانية; ثمان ...,
1165,وَحِيد,waHiyd,One of them.,adj,adj: masc singular lemma,,T2,0.333,8.818,media,high_frequency + dispersion,الوحيد; الوحيدة; والوحيد; وحيد; وحيدا ...,
1166,سَهْم,sahom,I'm going to.,noun,noun: singular lemma,سهم,T2,0.333,8.817,media,high_frequency + dispersion,أسهم; أسهمها; اسهم; الأسهم; الاسهم ...,
1167,إِيجاد,<iyjAd,Find him.,noun,noun: singular lemma,,T2,0.333,8.815,media,high_frequency + dispersion,إيجاد; ايجاد; بإيجاد; لإيجاد; لايجاد ...,
1168,تَنْسِيق,tanosiyq,Coordinate.,noun,noun: singular lemma,نسق,T2,0.333,8.814,media,high_frequency + dispersion,التنسيق; بالتنسيق; بتنسيق; تنسيق; لتنسيق ...,
1169,قَصْف,qaSof,The bomb.,noun,noun: singular lemma,قصف,T2,0.333,8.813,media,high_frequency + dispersion,القصف; بقصف; تقصف; قصف; قصفت ...,
1170,أَخْرَج,>axoraj,Get out of here.,verb,verb: 3ms past lemma,خرج,T2,0.333,8.811,media,high_frequency + dispersion,أخرجت; أخرجه; اخرج; نخرج; يخرج,
1171,فَوْق,fawoq,above,noun,noun: singular lemma,,T2,0.333,8.811,media,high_frequency + dispersion,فوق; فوقه; فوقها; وفوق,
1172,رَبْط,raboT,- What?,noun,noun: singular lemma,ربط,T2,0.333,8.811,media,high_frequency + dispersion,الربط; بربط; تربط; تربطه; تربطها ...,
1173,مُراقِب,murAqib,The guard.,noun,noun: singular lemma,رقب,T2,0.333,8.81,media,high_frequency + dispersion,المراقب; المراقبون; المراقبين; مراقب; مراقبا ...,
1174,واسِع,wAsiE,Wide.,adj,adj: masc singular lemma,,T2,0.333,8.81,media,high_frequency + dispersion,الواسع; الواسعة; واسع; واسعا; واسعاً ...,
1175,سَبْع,saboE,Seven.,adj,adj: masc singular lemma,سبع,T2,0.333,8.806,media,high_frequency + dispersion,السبع; السبعة; السبعين; بسبع; بسبعة ...,
1176,طِيلَةَ,Tiylapa,Long.,prep,particle/base,طلة,T2,0.333,8.805,media,high_frequency + dispersion,طيلة,
1177,جَدَّد,jad~ad,It's renovated.,verb,verb: 3ms past lemma,جدد,T2,0.333,8.805,media,high_frequency + dispersion,جدد; جددت; وجدد; وجددت; يجدد,
1178,أَدْلَى,>adolaY,I'm not.,verb,verb: 3ms past lemma,,T2,0.333,8.803,media,high_frequency + dispersion,أدلت; أدلوا; أدلى; ادلى; وأدلى ...,
1179,لَحْظَة,laHoZap,Just a minute.,noun,noun: singular lemma,لحظ,T2,0.333,8.803,media,high_frequency + dispersion,اللحظات; اللحظة; لحظات; لحظة; للحظة,
1180,أَنْهَى,>anohaY,It's over.,verb,verb: 3ms past lemma,,T2,0.333,8.803,media,high_frequency + dispersion,أنهت; أنهى; انهت; انهى; تنهي ...,
1181,اخري،,Axry،,Another one.,noun_prop,noun: singular lemma,,T2,0.333,8.802,media,high_frequency + dispersion,أخرى،; اخرى،,
1182,تارِيخِيّ,tAriyxiy~,My old man.,adj,adj: masc singular lemma,,T2,0.333,8.801,media,high_frequency + dispersion,التأريخية; التاريخي; التاريخية; تاريخي; تاريخيا ...,
1183,صَعْب,SaEob,It's hard.,adj,adj: masc singular lemma,صعب,T2,0.333,8.801,media,high_frequency + dispersion,الصعاب; الصعب; الصعبة; تصعب; صعب ...,
1184,جَمِيل,jamiyl,That's nice.,noun_prop,noun: singular lemma,جمل,T2,0.333,8.796,media,high_frequency + dispersion,الجميل; الجميلة; الجميّل; جميل; جميلا ...,
1185,مُباحَثَة,mubAHavap,A conversation.,noun,noun: singular lemma,بحث,T2,0.333,8.795,media,high_frequency + dispersion,المباحثات; مباحثات; مباحثاته; مباحثاتهما,
1186,ٱِسْتَغْرَق,{isotagoraq,- What? - Go down.,verb,verb: 3ms past lemma,غرق,T2,0.333,8.791,media,high_frequency + dispersion,استغرق; استغرقت; تستغرق; ستستغرق; سيستغرق ...,
1187,فرانْس,frAnos,French.,noun_prop,noun: singular lemma,,T2,0.333,8.79,media,high_frequency + dispersion,فرانس; لفرانس,
1188,تَسْلِيم,tasoliym,Give up.,noun,noun: singular lemma,سلم,T2,0.333,8.789,media,high_frequency + dispersion,التسليم; بتسليم; بتسليمه; بتسليمها; تسليم ...,
1189,صَحِيح,SaHiyH,That's right.,adj,adj: masc singular lemma,صحح,T2,0.333,8.788,media,high_frequency + dispersion,الصحيح; الصحيحة; الصحيحين; صحيح; صحيحا ...,
1190,بارِيس,bAriys,Paris.,noun_prop,noun: singular lemma,,T2,0.333,8.787,media,high_frequency + dispersion,باريس; بباريس; لباريس; وباريس,
1191,جِنْسِيَّة,jinosiy~ap,I'm not a sexist.,noun,noun: singular lemma,جنس,T2,0.333,8.786,media,high_frequency + dispersion,الجنسيات; الجنسية; جنسيات; جنسيته,
1192,مَعْبَر,maEobar,Through.,noun,noun: singular lemma,عبر,T2,0.333,8.786,media,high_frequency + dispersion,المعابر; المعبر; المعبرة; معابر; معبر ...,
1193,تِلفِزيُون,tilfizyuwn,You're watching TV.,noun,noun: singular lemma,,T2,0.333,8.785,media,high_frequency + dispersion,التلفزيون; التلفزيونات; التليفزيون; تلفزيون; تليفزيون ...,
1194,مَوْسِم,mawosim,The season.,noun,noun: singular lemma,,T2,0.333,8.785,media,high_frequency + dispersion,المواسم; الموسم; للموسم; لموسم; مواسم ...,
1195,غَد,gad,Tomorrow.,noun,noun: singular lemma,,T2,0.333,8.785,media,high_frequency + dispersion,الغد; غد; غدا; غداً; غدًا ...,
1196,شُكْر,$ukor,Thank you.,noun,noun: singular lemma,شكر,T2,0.333,8.785,media,high_frequency + dispersion,أشكر; اشكر; الشكر; بالشكر; تشكر ...,
1197,تَبِع,tabiE,Follow.,verb,verb: 3ms past lemma,تبع,T2,0.333,8.784,media,high_frequency + dispersion,اتبعها; تبعا; تبعاً; تبعه; تبعها ...,
1198,ٱِنْتِخابِيّ,{inotixAbiy~,My election.,adj,adj: masc singular lemma,نخب,T2,0.333,8.784,media,high_frequency + dispersion,الإنتخابية; الانتخابي; الانتخابية; انتخابي; انتخابيا ...,
1199,كلِينْتُون,kliynotuwn,I'm not going to lie.,noun_prop,noun: singular lemma,,T2,0.333,8.783,media,high_frequency + dispersion,كلينتون; لكلينتون; وكلينتون,
1200,ٱِحْتِجاج,{iHotijAj,Protest.,noun,noun: singular lemma,حجج,T2,0.333,8.783,media,high_frequency + dispersion,احتجاج; احتجاجا; احتجاجات; احتجاجاً; احتجاجهم ...,
1201,تَصْوِيت,taSowiyt,You voted.,noun,noun: singular lemma,,T2,0.333,8.782,media,high_frequency + dispersion,التصويت; بالتصويت; تصويت; للتصويت; والتصويت,
1202,تَوَتُّر,tawat~ur,Tightening.,noun,noun: singular lemma,,T2,0.333,8.782,media,high_frequency + dispersion,التوتر; التوترات; بالتوتر; توتر; توترا ...,
1203,أَجاب,>ajAb,Answer me.,verb,verb: 3ms past lemma,,T2,0.333,8.782,media,high_frequency + dispersion,أجاب; أجابت; إجابة; إجابته; اجاب ...,
1204,عَدْل,Eadol,Justice.,noun,noun: singular lemma,عدل,T2,0.333,8.781,media,high_frequency + dispersion,العدل; بالعدل; تعدل; عدل; عدلت ...,
1205,آبِد,|bid,I'm sorry.,noun,noun: singular lemma,,T2,0.333,8.779,media,high_frequency + dispersion,ابدا; ابداً; الأبد; الابد; فلابد ...,
1206,هاجَم,hAjam,He attacked.,verb,verb: 3ms past lemma,هجم,T2,0.333,8.779,media,high_frequency + dispersion,تهاجم; هاجم; هاجمت; هاجموا; وهاجم ...,
1207,مُواصَلَة,muwASalap,Keep going.,noun,noun: singular lemma,,T2,0.333,8.779,media,high_frequency + dispersion,المواصلات; بمواصلة; لمواصلة; مواصلة; والمواصلات ...,
1208,سِبْتَمْبِر,sibotamobir,You'll keep going.,noun_prop,noun: singular lemma,,T2,0.333,8.775,media,high_frequency + dispersion,سبتمبر,
1209,مُصالَحَة,muSAlaHap,- I'm not.,noun,noun: singular lemma,صلح,T2,0.333,8.775,media,high_frequency + dispersion,المصالحات; المصالحة; بالمصالحة; للمصالحة; مصالحات ...,
1210,رَسْم,rasom,A drawing.,noun,noun: singular lemma,رسم,T2,0.333,8.774,media,high_frequency + dispersion,الرسم; الرسوم; الرسومات; برسم; ترسم ...,
1211,مَحَلّ,maHal~,A place.,noun,noun: singular lemma,حلل,T2,0.333,8.774,media,high_frequency + dispersion,المحل; المحلات; محال; محالة; محل ...,
1212,مُوسَى,muwsaY,Moses.,noun_prop,noun: singular lemma,,T2,0.333,8.773,media,high_frequency + dispersion,الموسى; موسى; موسي; وموسى,
1213,مُتابَعَة,mutAbaEap,Following,noun,noun: singular lemma,تبع,T2,0.333,8.772,media,high_frequency + dispersion,المتابعة; بمتابعة; لمتابعة; متابعة; متابعته ...,
1214,بَرَى,baraY,He's innocent.,noun,noun: singular lemma,,T2,0.333,8.771,media,high_frequency + dispersion,البري; البرية; براك; بري; برية ...,
1215,مَقْعَد,maqoEad,A seat.,noun,noun: singular lemma,قعد,T2,0.333,8.771,media,high_frequency + dispersion,المقاعد; المقعد; بمقعد; مقاعد; مقاعده ...,
1216,والِد,wAlid,Dad; please.,noun,noun: singular lemma,,T2,0.333,8.77,media,high_frequency + dispersion,الوالد; الوالدة; الوالدين; لوالده; والد ...,
1217,مَرْكَزِيّ,marokaziy~,I'm focused.,adj,adj: masc singular lemma,ركز,T2,0.333,8.769,media,high_frequency + dispersion,المركزى; المركزي; المركزية; مركزي; مركزية,
1218,بَقاء,baqA',Stay.,noun,noun: singular lemma,,T2,0.333,8.764,media,high_frequency + dispersion,البقاء; بالبقاء; ببقاء; بقاء; بقاءه ...,
1219,جَزائِر,jazA}ir,Islands.,noun_prop,noun: singular lemma,جزر,T2,0.333,8.761,media,high_frequency + dispersion,الجزائر; بالجزائر; للجزائر; والجزائر,
1220,سَراح,sarAH,He's free.,noun,noun: singular lemma,سرح,T2,0.333,8.76,media,high_frequency + dispersion,السراح; سراح; سراحه; سراحها; سراحهم ...,
1221,رِحْلَة,riHolap,A trip.,noun,noun: singular lemma,رحل,T2,0.333,8.76,media,high_frequency + dispersion,الرحلات; الرحلة; برحلات; برحلة; رحلات ...,
1222,ٱِدَّعَى,{id~aEaY,Call it in.,verb,verb: 3ms past lemma,,T2,0.333,8.759,media,high_frequency + dispersion,ادعت; ادعوا; ادعى; تدعي; تدّعي ...,
1223,مُخَيَّم,muxay~am,Camp,noun,noun: singular lemma,,T2,0.333,8.759,media,high_frequency + dispersion,المخيم; المخيمات; للمخيم; مخيم; مخيمات,
1224,بَسّ,bas~,- That's it.,verb,verb: 3ms past lemma,بسس,T2,0.333,8.759,media,high_frequency + dispersion,بس; وبس,
1225,ماكين,mAkyn,I'm not.,noun_prop,noun: singular lemma,,T2,0.333,8.757,media,high_frequency + dispersion,ماكين,
1226,تَرَأَّس,tara>~as,He's headed.,verb,verb: 3ms past lemma,,T2,0.333,8.756,media,high_frequency + dispersion,تترأس; ترأس; ترأسه; ترأسها; سيترأس ...,
1227,قَبْض,qaboD,Hold it!,noun,noun: singular lemma,قبض,T2,0.333,8.756,media,high_frequency + dispersion,القبض; بالقبض; قبض; قبضت; للقبض ...,
1228,شِعار,$iEAr,A slogan.,noun,noun: singular lemma,شعر,T2,0.333,8.755,media,high_frequency + dispersion,الشعار; الشعارات; بالشعارات; بشعار; بشعارات ...,
1229,إِيهُود,<iyhuwd,Jews.,noun_prop,noun: singular lemma,,T2,0.333,8.751,media,high_frequency + dispersion,أيهود; إيهود; ايهود; وايهود,
1230,مُقارَنَة,muqAranap,Compared,noun,noun: singular lemma,قرن,T2,0.333,8.751,media,high_frequency + dispersion,المقارنة; بالمقارنة; للمقارنة; مقارنة; مقارنتها ...,
1231,طَبِيعِيّ,TabiyEiy~,It's natural.,adj,adj: masc singular lemma,طبع,T2,0.333,8.75,media,high_frequency + dispersion,الطبيعى; الطبيعي; الطبيعية; طبيعي; طبيعيا ...,
1232,رابِع,rAbiE,Fourth.,adj,adj: masc singular lemma,ربع,T2,0.333,8.748,media,high_frequency + dispersion,الرابع; الرابعة; رابع; رابعا; رابعاً ...,
1233,سُرْعَة,suroEap,Hurry up.,noun,noun: singular lemma,سرع,T2,0.333,8.748,media,high_frequency + dispersion,السرعة; بالسرعة; بسرعة; سرعة; سرعتها ...,
1234,أَنْتَ,>anota,you,pron,particle/base,,T2,0.333,8.748,media,high_frequency + dispersion,أنت; أنتِ; إنت; انت; فأنت ...,
1235,قادِر,qAdir,He can.,adj,adj: masc singular lemma,قدر,T2,0.333,8.747,media,high_frequency + dispersion,القادر; القادرة; القادرين; قادر; قادرا ...,
1236,ٱِعْتِماد,{iEotimAd,Depend on the situation.,noun,noun: singular lemma,عمد,T2,0.333,8.747,media,high_frequency + dispersion,اعتماد; اعتمادا; اعتماداً; اعتماده; اعتمادها ...,
1237,أَقْصَى,>aqoSaY,The most.,noun_prop,noun: singular lemma,,T2,0.333,8.746,media,high_frequency + dispersion,أقصاه; أقصاها; أقصى; اقصى; الأقصى ...,
1238,كلم,klm,- What?,abbrev,particle/base,,T2,0.333,8.746,media,high_frequency + dispersion,فكلما; كلم; كلما; وكلما,
1239,فَوْر,fawor,- What?,noun,noun: singular lemma,,T2,0.333,8.746,media,high_frequency + dispersion,الفور; فور; فورا; فوراً; فورة ...,
1240,مُقابَلَة,muqAbalap,An interview with,noun,noun: singular lemma,قبل,T2,0.333,8.746,media,high_frequency + dispersion,المقابلات; المقابلة; لمقابلة; مقابلات; مقابلة ...,
1241,مَطْلَع,maTolaE,Looking forward to it.,noun,noun: singular lemma,طلع,T2,0.333,8.745,media,high_frequency + dispersion,مطلع; مطلعة; ومطلع,
1242,بَذْل,ba*ol,That's it.,noun,noun: singular lemma,بذل,T2,0.333,8.745,media,high_frequency + dispersion,ببذل; بذل; بذلت; بذلتها; بذله ...,
1243,حَلِيف,Haliyf,I swear.,noun,noun: singular lemma,حلف,T2,0.333,8.745,media,high_frequency + dispersion,الحلفاء; الحليف; الحليفة; حلفاء; حلفائنا ...,
1244,تَمَيَّز,tamay~az,She is distinguished.,verb,verb: 3ms past lemma,,T2,0.333,8.745,media,high_frequency + dispersion,التميز; تتميز; تميزت; والتميز; وتتميز ...,
1245,نِيُويُورْك,niyuwyuwrok,I'm not in New York.,noun_prop,noun: singular lemma,,T2,0.333,8.745,media,high_frequency + dispersion,النيويورك; بنيويورك; نيويورك; ونيويورك,
1246,ناخِب,nAxib,Voters.,noun,noun: singular lemma,نخب,T2,0.333,8.744,media,high_frequency + dispersion,الناخب; الناخبون; الناخبين; للناخبين; ناخب ...,
1247,صِحِّيّ,SiH~iy~,- I'm all right.,adj,adj: masc singular lemma,صحح,T2,0.333,8.743,media,high_frequency + dispersion,الصحى; الصحي; الصحية; صحي; صحيا ...,
1248,وَضَّح,waD~aH,He explained.,verb,verb: 3ms past lemma,,T2,0.333,8.743,media,high_frequency + dispersion,توضح; وضح; ويوضح; يوضح,
1249,مُعارِض,muEAriD,Opposite.,noun,noun: singular lemma,عرض,T2,0.333,8.742,media,high_frequency + dispersion,المعارض; المعارضون; المعارضين; معارض; معارضا ...,
1250,شَرْقِيّ,$aroqiy~,My east.,adj,adj: masc singular lemma,شرق,T2,0.333,8.741,media,high_frequency + dispersion,الشرقي; الشرقية; الشرقيين; شرقي; شرقية ...,
1251,يُونِيُو,yuwniyuw,June.,noun_prop,noun: singular lemma,,T2,0.333,8.739,media,high_frequency + dispersion,يونيو,
1252,مَطْلَب,maTolab,Requested.,noun,noun: singular lemma,طلب,T2,0.333,8.739,media,high_frequency + dispersion,المطالب; المطلب; بمطالب; بمطالبة; للمطالب ...,
1253,إِنْسانِيّ,<inosAniy~,Human.,adj,adj: masc singular lemma,,T2,0.333,8.737,media,high_frequency + dispersion,إنساني; إنسانية; الإنساني; الانساني; الانسانية ...,
1254,مُمْكِن,mumokin,It could be.,adj,adj: masc singular lemma,مكن,T2,0.333,8.737,media,high_frequency + dispersion,الممكن; الممكنة; ممكن; ممكنا; ممكناً ...,
